Question,Answer,Domain
મહારાષ્ટ્ર નવનિર્માણ સેનાની રચના કોણે કરી?,મહારાષ્ટ્ર નવનિર્માણ સેના (અનુવાદ: મહારાષ્ટ્ર રિફોર્મેશન આર્મી; abbr. MNS) એ મહારાષ્ટ્ર રાજ્યમાં સ્થિત એક પ્રાદેશિકવાદી દૂર-જમણેરી ભારતીય રાજકીય પક્ષ છે અને હિન્દુત્વ અને મરાઠી માનુસની વિચારધારા પર કાર્ય કરે છે.[12][13] રાજ ઠાકરેએ તેમના પિતરાઈ ભાઈ ઉદ્ધવ ઠાકરે સાથેના મતભેદોને કારણે શિવસેના પક્ષ છોડી દીધા પછી 9 માર્ચ 2006ના રોજ મુંબઈમાં તેની સ્થાપના કરવામાં આવી હતી.,Politics
"2015 બિહાર ચૂંટણીમાં મુખ્ય પરિબળ શું હતું, જે સામાજિક ઇતિહાસકાર બદ્રી નારાયણ દ્વારા ઓળખવામાં આવ્યું હતું?","હિન્દુત્વની રાજનીતિ એ સામાજિક ઇતિહાસકાર બદ્રી નારાયણ દ્વારા રજૂ કરાયેલ જ્ઞાતિની રાજનીતિનો સામનો કરવાનો હતો, જેમણે 2015 ની રાજકીય ઉથલપાથલને ઘણા પ્રાદેશિક રાજકીય પક્ષો દ્વારા સામનો કરવામાં આવતા પડકારના ભાગ રૂપે ઓળખી હતી અને તે બધા નેતાઓને અંદરના ચોક્કસ જાતિ જૂથોના સમર્થનનો આનંદ માણ્યો હતો. તેમના રાજ્યો.",Politics
ઇન્ડિયન નેશનલ ડેવલપમેન્ટલ ઇન્ક્લુઝિવ એલાયન્સ (ભારત) ની રચના પાછળ શું પ્રેરણા હતી?,"2014 અને 2019 ની સામાન્ય ચૂંટણીઓમાં એનડીએને હરાવવામાં વિપક્ષની અસમર્થતા પછી, 2024 ની સામાન્ય ચૂંટણીઓમાં ભાજપની આગેવાની હેઠળના NDA સામે ઊભા રહેવા માટે લગભગ તમામ મુખ્ય રાજકીય પક્ષોના મહાગઠબંધનની જરૂરિયાતની પ્રેરણા હતી.",Politics
ફ્રીડમ હાઉસે 2023 માં ભારતીય લોકશાહીની સ્થિતિનું વર્ગીકરણ કેવી રીતે કર્યું?,"2023 માં ફ્રીડમ હાઉસ દ્વારા ફ્રિડમ ઇન ધ વર્લ્ડ રિપોર્ટમાં સતત ત્રીજા વર્ષે ભારતને ""અંશતઃ મુક્ત"" દેશ તરીકે વર્ગીકૃત કરવામાં આવ્યું હતું.",Politics
ચૂંટણી પંચ કયા કાયદા હેઠળ કામ કરે છે?,ચૂંટણી પંચ બંધારણના અનુચ્છેદ 324 દ્વારા આપવામાં આવેલી સત્તાઓ અને ત્યારબાદ અમલમાં આવેલ લોકપ્રતિનિધિત્વ અધિનિયમ હેઠળ કાર્ય કરે છે.,Politics
ભારત અને બ્રાઝિલની આબોહવાની તુલના કરો,"1. ભારતમાં ચોમાસાની આબોહવા છે જ્યારે બ્રાઝિલ આબોહવામાં વિવિધ પ્રકારની વિવિધતા અનુભવે છે. દા.ત. બ્રાઝિલમાં, વિષુવવૃત્તની નજીક, આબોહવા ગરમ છે જ્યારે મકર રાશિની ઉષ્ણકટિબંધની નજીક, સમશીતોષ્ણ પ્રકારનું આબોહવા છે. 2. ભારતમાં, સમગ્ર વર્ષ દરમિયાન સરેરાશ તાપમાન ઊંચું રહે છે કારણ કે સૂર્યના કિરણો કેન્સરના ઉષ્ણકટિબંધ સુધી લંબરૂપ હોય છે જે તેમાંથી પસાર થાય છે જ્યારે બ્રાઝિલમાં, વિષુવવૃત્ત દેશના ઉત્તરીય ભાગને કાપી નાખે છે જેનું પરિણામ 25 ""C થી 28 છે. એમેઝોન ખીણમાં સરેરાશ તાપમાન 3. ભારતના ઉત્તરીય રાજ્યોમાં તાપમાન ઠંડું છે, ઉદાહરણ તરીકે, જમ્મુ અને કાશ્મીર અને હિમાલયના પર્વતીય વિસ્તારો -40 ડિગ્રી સેલ્સિયસ તાપમાનમાં વધારો કરે છે તેનાથી વિપરીત, બ્રાઝિલનો ઉત્તરીય ભાગ સામાન્ય રીતે ગરમ હોય છે જ્યારે દક્ષિણ ભાગમાં તાપમાન તુલનાત્મક રીતે ઓછું હોય છે. પ્રકાર જ્યારે બ્રાઝિલ દક્ષિણ-પૂર્વના વેપાર પવનો અને ઉત્તર-પૂર્વના વેપાર પવનોથી ઓરોગ્રાફિક પ્રકારનો વરસાદ મેળવે છે અને બ્રાઝિલના ઉત્તર ભાગમાં વરસાદ કન્વેક્શનલ પ્રકારનો છે 5. ભારતમાં, ગુજરાત અને રાજસ્થાનના પ્રદેશોમાં ઓછો વરસાદ પડે છે જ્યારે બ્રાઝિલના હાઇલેન્ડના ઉત્તરપૂર્વીય ભાગમાં ખૂબ ઓછો વરસાદ પડે છે. 6. ભારતમાં, ઉષ્ણકટિબંધીય ચક્રવાત વારંવાર થાય છે જ્યારે આ ચક્રવાત બ્રાઝિલમાં ભાગ્યે જ થાય છે.",Geography
નર્મદા ખીણમાં કેન્દ્રિત વસાહતો જોવા મળે છે,નદીની નજીક ખેતીલાયક જમીનને કારણે નર્મદા ખીણમાં કેન્દ્રિત વસાહતો જોવા મળે છે. નર્મદા ખીણ મુખ્યત્વે ગુજરાત અને મધ્યપ્રદેશમાં આવેલી છે અને નદીની નજીકની જમીન ખૂબ ખેતીલાયક છે.,Geography
ખેડૂતોના હિતમાં સરકાર દ્વારા રજૂ કરાયેલા વિવિધ સંસ્થાકીય સુધારા કાર્યક્રમોની યાદી બનાવો.,"અન્ય પરિબળો કે જે વસાહતની પદ્ધતિને અસર કરી શકે છે તેમાં સમાવેશ થાય છે: પાણીની ઉપલબ્ધતા, જમીનનો ઢોળાવ અને આબોહવાની પેટર્ન.",Geography
ચોખાના વિકાસ માટે જરૂરી ભૌગોલિક પરિસ્થિતિઓનું વર્ણન કરો.,"ભારતમાં, ન્યુક્લિટેડ વસાહતો ઘણીવાર નર્મદા ખીણના ઉચ્ચપ્રદેશમાં જોવા મળે છે.",Geography
ભારત વિશ્વમાં …………..નું અગ્રણી ઉત્પાદક અને નિકાસકાર છે.,ચા,Geography
પીળી ક્રાંતિનો ઉલ્લેખ કરે છે,તેલીબિયાંના ઉત્પાદનમાં વધારો.,Geography
ચોખાના ઉત્પાદનની દ્રષ્ટિએ વિશ્વમાં ભારત કયું સ્થાન ધરાવે છે?,બીજું,Geography
ભારતમાં કોલસાના વિતરણનું વર્ણન કરો.,"ભારતમાં કોલસો બે મુખ્ય ભૂસ્તરશાસ્ત્રીય યુગની ખડક શ્રેણીમાં જોવા મળે છે, જેમ કે ગોંડવાના, 200 મિલિયન વર્ષથી થોડી વધુ ઉંમરના અને તૃતીય થાપણોમાં જે ફક્ત 55 મિલિયન વર્ષ જૂના છે. ગોંડવાના કોલસાના મુખ્ય સંસાધનો, જે મેટલર્જિકલ કોલસો છે, દામોદર ખીણ (પશ્ચિમ બંગાળ-ઝારખંડ)માં સ્થિત છે. ઝરિયા, રાનીગંજ, બોકારો એ મહત્વપૂર્ણ કોલસા ક્ષેત્ર છે. ગોદાવરી, મહાનદી, સોન અને વર્ધા ખીણોમાં પણ કોલસાનો ભંડાર છે. ઉત્તરપૂર્વીય રાજ્યો મેઘાલય, આસામ, અરુણાચલ પ્રદેશ અને નાગાલેન્ડમાં તૃતીય કોલસો જોવા મળે છે. ઝારખંડ સૌથી મોટું ઉત્પાદક છે જ્યાં ઝરિયા, બોકારો, કરમપુર, પલામુ કોલસાના મુખ્ય ક્ષેત્રો છે. પશ્ચિમ બંગાળમાં, રાણીગંજ, જલપાઈગુડી અને દાર્જિલિંગ કોલસાના ક્ષેત્રો છે. સરગુજા, બિલાસપુર, રાયગઢ અને બસ્તર જિલ્લાઓ છત્તીસગઢમાં જોવા મળતા કોલસાના ક્ષેત્રો છે. એમપી પાસે ચીનવેર જિલ્લામાં કોલસાના ક્ષેત્રો છે અને મહારાષ્ટ્રમાં, ચંદા મુખ્ય ક્ષેત્ર છે.",Geography
ઝારખંડનો કોડરમા ગયા-હઝારીબાગ પટ્ટો કયા ખનીજના ઉત્પાદનમાં અગ્રણી સ્થાન ધરાવે છે?,મીકા,Geography
ભારતમાં સૌથી જૂનું તેલ ઉત્પાદક રાજ્ય કયું છે?,આસામ,Geography
ભારતનો સૌથી ધનિક ખનિજ પટ્ટો છે ………………,દ્વીપકલ્પીય ઉચ્ચપ્રદેશ,Geography
નસો અને લોડ્સમાંથી કયા ખનીજ મેળવે છે?,"મુખ્ય ધાતુના ખનિજો જેવા કે ટીન, તાંબુ, જસત અને સીસું વગેરે નસો અને લોડ્સમાંથી મેળવવામાં આવે છે.",Geography
ચિપકો આંદોલનનો હેતુ શું હતો?,વન સંરક્ષણ,Geography
કયા વન્યજીવ સંરક્ષણ અધિનિયમે પ્રથમ વખત છોડની સંરક્ષિત પ્રજાતિઓની યાદીમાં સમાવેશ કર્યો છે?,વાઇલ્ડલાઇફ પ્રોટેક્શન એક્ટ 1972,Geography
જે માટી તીવ્ર લીચિંગ દ્વારા રચાય છે,લેટેરાઇટ માટી,Geography
ઔદ્યોગિક ક્ષેત્રને જાહેર અને ખાનગી ક્ષેત્રોમાં કયા આધારે વર્ગીકૃત કરવામાં આવે છે?,સાહસોની માલિકી,Geography
કયું શહેર ભારતનું માન્ચેસ્ટર તરીકે ઓળખાય છે?,અમદાવાદ,Geography
ભારતમાં સ્ટીલનો માથાદીઠ વપરાશ છે,વર્ષ 2022-23 દરમિયાન દેશમાં સ્ટીલનો વપરાશ 119.89 મેટ્રિક ટન અને માથાદીઠ સ્ટીલનો વપરાશ 86.7 કિગ્રા હતો.,Geography
સિંધુ અને ગંગા નદીઓનું મૂળ ક્યાં છે?,"ભાગીરથી' તરીકે ઓળખાતા ગંગાના મુખ્ય પાણીને ગંગોત્રી ગ્લેશિયર દ્વારા ખવડાવવામાં આવે છે અને ઉત્તરાંચલમાં દેવપ્રયાગ ખાતે અલકનંદા દ્વારા જોડાય છે. હરિદ્વારમાં, ગંગા પર્વતોમાંથી મેદાનો પર નીકળે છે. સિંધુ બાલ્ટિસ્તાન અને ગિલગિટમાંથી વહે છે અને એટોકના પર્વતોમાંથી નીકળે છે.",Geography
કઇ બે દ્વીપકલ્પીય નદીઓ ખાડામાંથી વહે છે?,"નર્મદા અને તાપી એ બે દ્વીપકલ્પીય નદીઓ છે, જે ચાટમાંથી વહે છે.",Geography
આજના કયા ખંડો ગોંડવાના ભૂમિનો ભાગ હતા?,"સૌથી જૂનો લેન્ડમાસ, (દ્વીપકલ્પનો ભાગ), ગોંડવાના જમીનનો એક ભાગ હતો. ગોંડવાના ભૂમિમાં ભારત, ઓસ્ટ્રેલિયા, દક્ષિણ આફ્રિકા અને દક્ષિણ અમેરિકાનો એક જ ભૂમિ સમૂહ તરીકે સમાવેશ થાય છે.",Geography
કયા બે દેશો સૌથી લાંબી આંતરરાષ્ટ્રીય સરહદ ધરાવે છે?,કેનેડા અને યુનાઇટેડ સ્ટેટ્સ,Geography
વિશ્વનું સૌથી ગીચ વસ્તી ધરાવતું શહેર કયું છે?,"મનિલા, ફિલિપાઇન્સ",Geography
નીચેનામાંથી કયું રાજ્ય ભારતમાં કોફીનું સૌથી વધુ ઉત્પાદક છે?,કર્ણાટક,Geography
સિરોહી પોઈન્ટ પૃથ્વી પર ક્યાં આવેલું છે?,એન્ટાર્કટિકા,Geography
ભારતની સૌથી મોટી અંતર્દેશીય ક્ષારયુક્ત વેટલેન્ડ સિસ્ટમ કયા રાજ્યમાં આવેલી છે?,રાજસ્થાન,Geography
ભારતના કુલ વિસ્તારના કેટલા ટકા વિસ્તાર ગંગા નદીએ કબજે કર્યો છે?,26.30%,Geography
અલકનંદા નદી કયા ગ્લેશિયરમાંથી નીકળે છે?,સતોપંથ ગ્લેશિયર,Geography
કઈ નદી વુલર તળાવને પાણી આપે છે?,જેલમ,Geography
વ્હીલર આઇલેન્ડ કયા ટાપુનું પહેલાનું નામ હતું?,વ્હીલર આઇલેન્ડ અબ્દુલ કલામ આઇલેન્ડનું પહેલાનું નામ હતું. તે ઓડિશાના દરિયાકિનારે આવેલું છે. ડિફેન્સ રિસર્ચ એન્ડ ડેવલપમેન્ટ ઓર્ગેનાઈઝેશન (DRDO)ની ઈન્ટિગ્રેટેડ ટેસ્ટ રેન્જ આ ટાપુ પર આવેલી છે.,Geography
કયું એકમાત્ર અભયારણ્ય છે જ્યાં કાશ્મીર હરણ જોવા મળે છે?,દચીગામ રાષ્ટ્રીય ઉદ્યાન એકમાત્ર અભયારણ્ય છે જ્યાં કાશ્મીર હરણ જોવા મળે છે. તે કાશ્મીરમાં આવેલું છે.,Geography
બાયોસ્ફિયર રિઝર્વ પ્રોગ્રામ ભારતમાં કયા વર્ષમાં શરૂ કરવામાં આવ્યો હતો?,બાયોસ્ફિયર રિઝર્વ પ્રોગ્રામ ભારતમાં વર્ષ 1986માં શરૂ કરવામાં આવ્યો હતો. ભારતમાં કુલ 18 બાયોસ્ફિયર રિઝર્વ છે.,Geography
સામાન્ય રીતે કયા પ્રકારના ખડકોમાં અવશેષો જોવા મળે છે?,"અવશેષો સામાન્ય રીતે જળકૃત ખડકોમાં રચાય છે. જ્યારે સજીવ મૃત્યુ પામે છે અને કાંપમાં દટાઈ જાય છે, ત્યારે આ કાંપ આખરે કઠણ થઈને કાંપના ખડકમાં પરિણમે છે અને જીવને અશ્મિ તરીકે સાચવવામાં આવે છે. આ પ્રક્રિયાને અશ્મિભૂત કહેવામાં આવે છે. અગ્નિકૃત અને મેટામોર્ફિક ખડકો ગરમી અથવા દબાણથી બને છે અને તે અવશેષોનો નાશ કરે તેવી શક્યતા છે.",Geography
"""મેડિસિન લાઇન"" અક્ષાંશ વર્તુળનું બીજું નામ છે?","49મી સમાંતરને 1800 ના દાયકામાં અભિયાનો દરમિયાન યુએસ સૈનિકોને તેને પાર કરતા અટકાવવાની જાદુઈ ક્ષમતાને કારણે મેડિસિન લાઇનનું હુલામણું નામ આપવામાં આવ્યું હતું. 49મી સમાંતર ઉત્તર યુરોપ, એશિયા, પેસિફિક મહાસાગર, ઉત્તર અમેરિકા અને એટલાન્ટિક મહાસાગરને પાર કરે છે.",Geography
"ચનાબ નદી ચંદ્રભાગા તરીકે પણ ઓળખાય છે, જે ચંદ્ર અને ભાગા નદીઓના વિલીનીકરણથી કયા સ્થળની નજીક બને છે?","ચનાબ નદી, જેને ચંદ્રભાગા નદી તરીકે પણ ઓળખવામાં આવે છે, તે હિમાચલ પ્રદેશના લાહૌલ સ્પીતિ જિલ્લામાં ટાંડી ખાતે ચંદ્ર અને ભાગા નદીઓના વિલીનીકરણથી બનેલી છે. ચંદ્રા અને ભગા નદીઓ 4,891 મીટરની ઉંચાઈએ બરાલાચા પાસની વિરુદ્ધ બાજુઓમાંથી નીકળે છે. તેઓ 2,286 મીટરની ઉંચાઈ પર ટાંડી ખાતે મળે છે.",Geography
કયો ગ્રહ તેના દિવસની લંબાઈ ધરાવે છે અને તેની ધરીનો ઝુકાવ લગભગ પૃથ્વીના સમાન હોય છે?,મંગળ,Geography
વિશ્વનો સૌથી મોટો ટાપુ દેશ કયો છે?,"ઇન્ડોનેશિયા વિશ્વનો સૌથી મોટો ટાપુ દેશ છે કારણ કે તેનું ક્ષેત્રફળ 1,904,569 ચોરસ કિમી છે અને તેમાં 18,307 થી વધુ ટાપુઓ છે. તે વિશ્વનો સૌથી વધુ વસ્તી ધરાવતો ટાપુ દેશ પણ છે.",Geography
મોટી નદીની ઉપનદી ધરાવતી ખીણોને શું કહે છે?,બાજુની ખીણ એ મોટી નદીની ઉપનદી સાથેની ખીણ છે. તેઓ પર્વતોની નજીક ઉચ્ચ ક્રમની ખીણો છે.,Geography
“માબલા પર્વતો” કયા દેશમાં આવેલા છે?,"માબલા પર્વતો, જેને મોન્ટી માબલા તરીકે પણ ઓળખવામાં આવે છે, તે જીબુટીના ઓબોક અને તાડજૌરા પ્રદેશોમાં સ્થિત પર્વતમાળા છે. આ પર્વતો, જે જીબુટીમાં પાંચમા-ઉચ્ચ બિંદુ છે, સ્થાનિક જીબુટી સ્પુરફોલ અને ડે ફોરેસ્ટ નેશનલ પાર્ક ધરાવે છે. આ ઉચ્ચ પ્રદેશ તાડજૌરાના અખાતની ઉત્તર બાજુએ, દરિયાકાંઠાના મેદાનની પાછળ આવેલો છે જ્યાં લાલ સમુદ્ર એડનના અખાતને મળે છે.",Geography
સૌથી પહેલું વાવેતર ક્યાં આવ્યું?,સૌથી જૂનું વાવેતર આફ્રિકાના ગિની કિનારે આવેલા ટાપુઓ પર 15મી સદીની સ્થાપનાઓનું છે. શેરડીના ઉત્પાદન માટે પોર્ટુગીઝ દ્વારા આ સિસ્ટમને અહીંથી ઉત્તર બ્રાઝિલમાં લઈ જવામાં આવી હતી.,Geography
શનિવાર વાડાના બાંધકામનો ખર્ચ કેટલો હતો?,"શનિવારવાડા 1732 માં પૂર્ણ થયો હતો, કુલ રૂ. 16,110, તે સમયે ખૂબ મોટી રકમ.",History
છત્રપતિ શાહુ મહારાજનું શાસન ક્યારે શરૂ થયું અને ક્યારે સમાપ્ત થયું?,છત્રપતિ શાહુ મહારાજનું શાસન 12 જાન્યુઆરી 1708 ના રોજ શરૂ થયું અને 15 ડિસેમ્બર 1749 ના રોજ સમાપ્ત થયું.,History
બહમાની સલ્તનતની સ્થાપના કોણે કરી?,1347 માં અલાઉદ્દીન બહમન શાહ દ્વારા બહમાની સલ્તનતની સ્થાપના કરવામાં આવી હતી.,History
‘ગદ આલા પણ સિંહા ગેલા’ કોણે કોને કહ્યું?,"તાનાજી માલુસરેના બલિદાન પર કિલ્લો કબજે કરવામાં આવ્યો હતો તે જાણ્યા પછી શિવાજીએ ""ગડ આલા, પણ સિંહા ગેલા""- ""અમે કિલ્લો જીતી લીધો, પરંતુ સિંહ હારી ગયા"" કહીને તેમનો ઊંડો રોષ દર્શાવ્યો હોવાનું કહેવાય છે.",History
