Question,Answer,Domain
1920 માં અસહકાર ચળવળની શરૂઆત સાથે કોનું મૃત્યુ થયું હતું?,"1 ઓગસ્ટ 1920 ના રોજ અસહકાર આંદોલનની જાહેરાત કરવામાં આવી, તે જ દિવસે વહેલી સવારે બાળ ગંગાધર તિલકના મૃત્યુના સમાચાર આવ્યા.",Politics
કયો ભારતીય કાર્યકર્તા 'લોકહિતવાડી' તરીકે પ્રખ્યાત હતો?,"રાવ બહાદુર ગોપાલ હરિ દેશમુખ () જેને લોકહિતવાદી તરીકે પણ ઓળખવામાં આવે છે (18 ફેબ્રુઆરી 1823 - 9 ઓક્ટોબર 1892) મહારાષ્ટ્રના ભારતીય કાર્યકર, વિચારક, સમાજ સુધારક અને લેખક હતા.",Politics
ભારતના પ્રથમ રાષ્ટ્રપતિ અને યુએસએના પ્રથમ રાષ્ટ્રપતિ કોણ હતા?,"રાજેન્દ્ર પ્રસાદ એક ભારતીય રાજકારણી, વકીલ, પત્રકાર અને વિદ્વાન હતા જેમણે 1950 થી 1962 સુધી ભારતના પ્રથમ રાષ્ટ્રપતિ તરીકે સેવા આપી હતી. જ્યોર્જ વોશિંગ્ટન (ફેબ્રુઆરી 22, 1732 - ડિસેમ્બર 14, 1799) એક અમેરિકન સ્થાપક પિતા, લશ્કરી અધિકારી અને રાજકારણી હતા. 1789 થી 1797 સુધી યુનાઇટેડ સ્ટેટ્સના પ્રથમ પ્રમુખ તરીકે સેવા આપી હતી.",Politics
કોણ હતા અબ્દુલ કલામ? ટૂંકમાં વર્ણન કરો.,"એપીજે અબ્દુલ કલામ (જન્મ ઓક્ટોબર 15, 1931, રામેશ્વરમ, ભારત—મૃત્યુ 27 જુલાઈ, 2015, શિલોંગ) એક ભારતીય વૈજ્ઞાનિક અને રાજકારણી હતા જેમણે ભારતના મિસાઈલ અને પરમાણુ શસ્ત્રોના કાર્યક્રમોના વિકાસમાં અગ્રણી ભૂમિકા ભજવી હતી. તેઓ 2002 થી 2007 સુધી ભારતના રાષ્ટ્રપતિ હતા.",Politics
મોદીના પ્રથમ કાર્યકાળ દરમિયાન ભારતના નાણામંત્રી કોણ હતા?,"અરુણ જેટલી (28 ડિસેમ્બર 1952 - 24 ઓગસ્ટ 2019) એક ભારતીય રાજકારણી અને વકીલ હતા. ભારતીય જનતા પાર્ટીના સભ્ય, જેટલીએ 2014 થી 2019 સુધી ભારત સરકારના નાણા અને કોર્પોરેટ બાબતોના મંત્રી તરીકે સેવા આપી હતી.",Politics
નરેન્દ્ર મોદીની શૈક્ષણિક લાયકાત શું છે?,"1978માં, મોદીએ દિલ્હી યુનિવર્સિટીની સ્કૂલ ઓફ ઓપન લર્નિંગમાંથી પોલિટિકલ સાયન્સમાં બી.એ.ની ડિગ્રી મેળવી, ત્રીજા વર્ગ સાથે સ્નાતક થયા. પાંચ વર્ષ પછી, 1983 માં, તેમણે બાહ્ય અંતર શિક્ષણના વિદ્યાર્થી તરીકે ગુજરાત યુનિવર્સિટીમાંથી રાજકીય વિજ્ઞાનમાં માસ્ટર ઓફ આર્ટ્સની ડિગ્રી મેળવી.",Politics
અયોધ્યામાં વિવાદિત માળખું ક્યારે તોડી પાડવામાં આવ્યું? રાજ્ય કેવું હતું. સરકારે સજા કરી?,"6 ડિસેમ્બર, 1992ના રોજ અયોધ્યાના વિવાદિત ઢાંચાને એટલે કે બાબરી મસ્જિદને તોડી પાડવામાં આવી હતી. ઉત્તર પ્રદેશની ભાજપ સરકારને બરખાસ્ત કરવામાં આવી હતી અને ઉત્તર પ્રદેશના મુખ્યપ્રધાન સામે સુપ્રીમ કોર્ટમાં કોર્ટના તિરસ્કારનો કેસ નોંધવામાં આવ્યો હતો.",Politics
બંધારણની કઇ કલમ ભારતના રાષ્ટ્રપતિની ચૂંટણી સાથે સંબંધિત છે?,"ભારતના બંધારણના અનુચ્છેદ 54 મુજબ, રાષ્ટ્રપતિની ચૂંટણી ઈલેક્ટોરલ કૉલેજ દ્વારા કરવામાં આવે છે, જેમાં સંસદના બંને ગૃહોના ચૂંટાયેલા સભ્યો અને તમામ રાજ્યોની વિધાનસભાઓના ચૂંટાયેલા સભ્યો અને દિલ્હીના NCTના ચૂંટાયેલા સભ્યોનો સમાવેશ થાય છે. કેન્દ્રશાસિત પ્રદેશ પુડુચેરી.",Politics
મહારાષ્ટ્રમાં લોકસભાની બેઠકોની સંખ્યા કેટલી છે?,"48 લોકસભા બેઠકો સાથે, મહારાષ્ટ્ર ઉત્તર પ્રદેશ પછી બીજા ક્રમની સૌથી વધુ બેઠકો ધરાવે છે, જ્યાં 80 બેઠકો છે.",Politics
જેમણે બંધારણની મુસદ્દા સમિતિ સમક્ષ પ્રસ્તાવનાનો પ્રસ્તાવ મૂક્યો હતો,"પ્રસ્તાવના નેહરુના ""ઉદ્દેશ ઠરાવ"" પર આધારિત છે. જવાહરલાલ નેહરુએ એક ઉદ્દેશ્ય ઠરાવનો પ્રસ્તાવ મૂક્યો અને તે જ સમયે ડૉ. બી.આર. આંબેડકરે બંધારણના લખાણ અને પ્રસ્તાવનાની રચના કરી.",Politics
1973માં ભારતના મુખ્ય ન્યાયાધીશ તરીકે કોની નિમણૂક કરવામાં આવી હતી? શા માટે આ નિમણૂક વિવાદાસ્પદ બની?,"1973 માં, સરકારે ત્રણ ન્યાયાધીશોની વરિષ્ઠતાને બાજુ પર મૂકી અને જસ્ટિસ એએન રેને ભારતના મુખ્ય ન્યાયાધીશ તરીકે નિયુક્ત કર્યા. નિમણૂક રાજકીય રીતે વિવાદાસ્પદ બની હતી કારણ કે જે ત્રણેય ન્યાયાધીશોને રદ કરવામાં આવ્યા હતા તેઓએ સરકારના સ્ટેન્ડ વિરુદ્ધ ચુકાદા આપ્યા હતા.",Politics
માર્ચ 1977ની સામાન્ય ચૂંટણીઓમાં જનતા પાર્ટી અને તેના સહયોગીઓએ કેટલી લોકસભા બેઠકો જીતી હતી?,જનતા પાર્ટી અને તેના સહયોગીઓએ લોકસભાની 542 બેઠકોમાંથી 330 બેઠકો જીતી હતી; જનતા પાર્ટીએ પોતે 295 બેઠકો જીતી અને આમ સ્પષ્ટ બહુમતીનો આનંદ માણ્યો.,Politics
2024 સુધી મહારાષ્ટ્રના મુખ્યમંત્રી કોણ છે?,એકનાથ સંભાજી શિંદે એક ભારતીય રાજકારણી છે જે 30 જૂન 2022 થી મહારાષ્ટ્રના 20મા અને વર્તમાન મુખ્ય પ્રધાન તરીકે સેવા આપી રહ્યા છે. તેઓ ફેબ્રુઆરી 2023 થી શિવસેનાના નેતા અને જુલાઈ 2022 થી મહારાષ્ટ્ર વિધાનસભાના ગૃહના નેતા તરીકે પણ સેવા આપી રહ્યા છે. .,Politics
કઈ હાઈકોર્ટે 12મી જૂન 1975ના રોજ વડાપ્રધાન ઈન્દિરા ગાંધી વિરુદ્ધ ચુકાદો આપ્યો હતો અને તેમણે 1971ની લોકસભાની સદસ્યતા ગુમાવી હતી.,"ઉત્તર પ્રદેશ રાજ્ય વિ. રાજ નારાયણ (1975 AIR 865, 1975 SCR (3) 333) એ 1975નો એક કેસ હતો જેની સુનાવણી અલ્હાબાદ હાઈકોર્ટ દ્વારા કરવામાં આવી હતી જેમાં ભારતના વડા પ્રધાન ઈન્દિરા ગાંધીને ચૂંટણીમાં ગેરરીતિઓ માટે દોષિત ઠેરવવામાં આવ્યા હતા.",Politics
ભારતમાં રજવાડાઓના એકીકરણમાં સરદાર પટેલે ભજવેલી ભૂમિકા સમજાવો.,"સ્વતંત્રતા પછીના નિર્ણાયક સમયગાળા દરમિયાન સરદાર પટેલ ભારતના નાયબ વડા પ્રધાન અને ગૃહ પ્રધાન હતા. તેમણે રજવાડાના શાસકો સાથે મજબૂત પરંતુ રાજદ્વારી રીતે વાટાઘાટો કરવામાં અને તેમાંના મોટાભાગનાને ભારતીય સંઘમાં લાવવામાં ઐતિહાસિક ભૂમિકા ભજવી હતી. સરદાર પટેલે ભારતમાં રજવાડાઓના એકીકરણમાં નીચેની ભૂમિકાઓ ભજવી હતી: તેમણે મુત્સદ્દીગીરી અને વાટાઘાટો દ્વારા રજવાડાઓ પાસેથી વિલયનો પત્ર મેળવ્યો હતો. તેમણે હૈદરાબાદ, જૂનાગઢ, મણિપુર અને કાશ્મીર રાજ્યો સાથે તેમના વિલીનીકરણ માટે બળ અને સમજાવટનો ઉપયોગ કર્યો.",Politics
1952ની પ્રથમ સામાન્ય ચૂંટણીમાં કોંગ્રેસ પાર્ટી અને ભારતીય જનસંઘના ચૂંટણી ચિહ્નો શું હતા?,"1952 ની પ્રથમ સામાન્ય ચૂંટણીમાં, કોંગ્રેસ પક્ષનું પ્રતીક બળદની જોડી અને દીવો (દીપક) ભારતીય જનસંઘનું પ્રતીક હતું.",Politics
શિવસેનાનું મુખ્યાલય ક્યાં આવેલું છે?,"શિવસેનાનું મુખ્યાલય અને મુખ્ય કાર્યાલય થાણેમાં આનંદ દિઘેના ઘરે આવેલું છે. દિઘે શિવસેનાના મુખ્ય નેતા (મુખ્ય નેતા) એકનાથ શિંદેના ગુરુ અને માર્ગદર્શક હતા. 24 ફેબ્રુઆરી 2023ના રોજ, શિંદેએ ઉદ્ધવ ઠાકરે પાસેથી પક્ષની કમાન સંભાળી લીધા પછી મુખ્યમથકને શિવસેના ભવનમાંથી ખસેડવામાં આવ્યું;[75] જ્યારે ઠાકરેના જૂથે શિવસેના ભવન પર નિયંત્રણ જાળવી રાખ્યું.",Politics
પોતાનો સત્તાવાર ધ્વજ ધરાવતું એકમાત્ર ભારતીય રાજ્ય કયું હતું?,"જમ્મુ અને કાશ્મીરનો રાજ્ય ધ્વજ એ ભારતના બંધારણના અનુચ્છેદ 370 દ્વારા પ્રદેશને આપવામાં આવેલ વિશેષ દરજ્જા હેઠળ 1952 અને 2019 ની વચ્ચે ભારતના ભૂતપૂર્વ જમ્મુ અને કાશ્મીર રાજ્યમાં ઉપયોગમાં લેવાતો પ્રતીક હતો. તે હળ અને રાજ્યના ત્રણ ઘટક પ્રદેશોના પ્રતિનિધિત્વ સાથે લાલ અને સફેદ ધ્વજ હતો. ઓગસ્ટ 2019 માં કલમ 370 નાબૂદ થયા પછી, આ ધ્વજ તેની સત્તાવાર સ્થિતિ ગુમાવી બેઠો.",Politics
પંજાબ પર પ્રભુત્વ ધરાવતા ત્રણ રાજકીય પક્ષોની યાદી આપો?,"પુનઃસંગઠિત વર્તમાન પંજાબમાં રાજકારણમાં મુખ્યત્વે ત્રણ પક્ષોનું વર્ચસ્વ છે - ભારતીય રાષ્ટ્રીય કોંગ્રેસ, આમ આદમી પાર્ટી અને શિરોમણી અકાલી દળ (બાદલ).",Politics
2024 સુધી યુપીના આરોગ્ય મંત્રી કોણ છે?,"જય પ્રતાપ સિંહ (જન્મ 7 સપ્ટેમ્બર 1953) એક ભારતીય રાજકારણી છે જેઓ ઉત્તર પ્રદેશ સરકારના યોગી આદિત્યનાથ મંત્રાલયમાં તબીબી અને આરોગ્ય, કુટુંબ કલ્યાણ, માતા અને બાળ કલ્યાણ મંત્રી તરીકે સેવા આપે છે.",Politics
2024 સુધીમાં MP માં હાલમાં કઈ સરકાર સત્તામાં છે?,"ડો. મોહન યાદવ (જન્મ 25 માર્ચ 1965) એક ભારતીય રાજકારણી અને ઉદ્યોગપતિ છે જે 2023 (2024 મુજબ) થી મધ્યપ્રદેશના 19મા અને વર્તમાન મુખ્યમંત્રી તરીકે સેવા આપી રહ્યા છે. ભારતીય જનતા પાર્ટીના સભ્ય, તેઓ 2013 થી મધ્ય પ્રદેશની વિધાનસભાના સભ્ય તરીકે ઉજ્જૈન દક્ષિણ મતવિસ્તારનું પ્રતિનિધિત્વ કરે છે.",Politics
2007 માં યુપી વિધાનસભા ચૂંટણીના મતદાન પરિણામ શું હતું?,બહુજન સમાજ પાર્ટીએ 403 માંથી 206 બેઠકો જીતીને વિધાનસભામાં સંપૂર્ણ બહુમતી મેળવી.,Politics
એમ. કરુણાનિધિ સૌપ્રથમ તમિલનાડુ વિધાનસભા માટે કયા મતદારક્ષેત્રમાંથી ચૂંટાયા હતા?,કુલીથલાઈ,Politics
જેમને દક્ષિણ ભારતના પ્રથમ સામ્યવાદી માનવામાં આવે છે,"મલયાપુરમ સિંગારાવેલુને દક્ષિણ ભારતના પ્રથમ સામ્યવાદી માનવામાં આવે છે. 1925માં, તેઓ કોમ્યુનિસ્ટ પાર્ટી ઓફ ઈન્ડિયાના સ્થાપક પિતાઓમાંના એક બન્યા; અને કાનપુરમાં તેના ઉદ્ઘાટન સંમેલનની અધ્યક્ષતા કરી હતી. તેઓ ભારતમાં પ્રથમ ટ્રેડ યુનિયનનું આયોજન કરવા માટે પણ જાણીતા છે અને 19મી સદીના ભારતમાં પ્રચલિત ગંભીર અસ્પૃશ્યતાના વ્યાપ સામે લડ્યા હતા.",Politics
આંધ્ર પ્રદેશમાં સૌથી પ્રભાવશાળી રાજકીય પક્ષના સ્થાપક કોણ હતા?,તેલુગુ દેશમ પાર્ટી (TDP; અનુવાદ. પાર્ટી ઓફ ધ તેલુગુ લેન્ડ) એ આંધ્ર પ્રદેશ અને તેલંગાણા રાજ્યોમાં પ્રભાવ ધરાવતો ભારતીય પ્રાદેશિક રાજકીય પક્ષ છે. તેની સ્થાપના તેલુગુ મૂવી સ્ટાર એનટી રામા રાવ (એનટીઆર) દ્વારા 29 માર્ચ 1982ના રોજ કરવામાં આવી હતી અને તેણે તેલુગુ લોકોને ટેકો આપવા પર ધ્યાન કેન્દ્રિત કર્યું છે.,Politics
કર્ણાટકની રાજનીતિ પર પ્રભુત્વ ધરાવતા જાતિ જૂથોનો ઉલ્લેખ કરો?,કર્ણાટકના રાજકીય વાતાવરણમાં બે જાતિ જૂથોનું વર્ચસ્વ છે - દક્ષિણ કર્ણાટક વોક્કાલિગાસનું વર્ચસ્વ ધરાવતું અને ઉત્તર અને મધ્ય કર્ણાટકમાં લિંગાયતોનું વર્ચસ્વ છે પરંતુ દલિતો મુખ્ય મતદારો છે અને કર્ણાટકમાં શાસક પક્ષનું નિર્ણાયક પરિબળ છે.,Politics
ભારતના કયા રાજ્યમાં સામ્યવાદીઓ સત્તા માટે ચૂંટાયા?,"કેરળએ 1957માં સામ્યવાદીઓને લોકશાહી રીતે સત્તા પર ચૂંટીને ઈતિહાસ રચ્યો હતો, આવું કરનાર વિશ્વમાં સૌપ્રથમ હતું.",Politics
બિહારમાં વહીવટી હેતુઓ માટે કેટલા વિભાગો છે?,"વહીવટી હેતુઓ માટે, બિહાર રાજ્યમાં નવ વિભાગો છે - પટના, તિર્હુત, સારણ, દરભંગા, કોસી, પૂર્ણિયા, ભાગલપુર, મુંગેર અને મગધ વિભાગ - જે તેમની વચ્ચે આડત્રીસ જિલ્લાઓમાં વિભાજિત છે.",Politics
પશ્ચિમ બંગાળમાં શરણાર્થીઓના ધસારામાં શું પરિણમ્યું?,"1971 ના બાંગ્લાદેશ મુક્તિ યુદ્ધના પરિણામે લાખો શરણાર્થીઓ પશ્ચિમ બંગાળમાં પ્રવેશ્યા, જેના કારણે તેના માળખાકીય સુવિધાઓ પર નોંધપાત્ર તાણ આવી. આંતરરાષ્ટ્રીય મીડિયા દ્વારા શરણાર્થી સંકટને સારી રીતે સંભાળવા માટે સરકારને શ્રેય આપવામાં આવ્યો હતો.",Politics
2024 સુધીમાં પશ્ચિમ બંગાળમાં મુખ્ય રાજકીય પક્ષ કયો છે?,"અખિલ ભારતીય તૃણમૂલ કોંગ્રેસ પશ્ચિમ બંગાળમાં વર્તમાનમાં શાસન કરી રહેલ રાજકીય પક્ષ છે. 2011ની પશ્ચિમ બંગાળ વિધાનસભાની ચૂંટણીમાં, ડાબેરી મોરચાને અખિલ ભારતીય તૃણમૂલ કોંગ્રેસ દ્વારા પરાજય મળ્યો હતો જેણે સંપૂર્ણ બહુમતી બેઠકો જીતી હતી. આનાથી પશ્ચિમ બંગાળમાં 34 વર્ષના સામ્યવાદી શાસનનો અંત આવ્યો તેમજ વિશ્વની સૌથી લાંબી સેવા આપતી લોકતાંત્રિક રીતે ચૂંટાયેલી સામ્યવાદી સરકારનો અંત આવ્યો. તૃણમૂલ કોંગ્રેસના નેતા મમતા બેનર્જી મુખ્યમંત્રી બન્યા.",Politics
ઓરિસ્સામાં પ્રાંતીય વિધાનસભાની ચૂંટણી માટે કયો અધિનિયમ પ્રદાન કરે છે?,"ભારત સરકારનો અધિનિયમ 1935 પ્રાંતીય વિધાનસભા અને સરકારની ચૂંટણી માટે પ્રદાન કરે છે, અને સરકારના વડાને વડા પ્રધાન તરીકે નિયુક્ત કરવામાં આવ્યા હતા.",Politics
ગુજરાતના પ્રથમ મહિલા મુખ્યમંત્રી કોણ હતા?,આનંદીબેન મફતભાઈ પટેલ (જન્મ 21 નવેમ્બર 1941) એ ગુજરાતના પ્રથમ અને એકમાત્ર (2024 સુધી) મહિલા મુખ્યમંત્રી તરીકે સેવા આપી હતી.,Politics
2022ની ગુજરાત વિધાનસભાની ચૂંટણીમાં કયા પક્ષે બહુમતી મેળવી?,"2022ની ગુજરાત વિધાનસભાની ચૂંટણીમાં, ભારતીય જનતા પાર્ટીએ 156 બેઠકોની સુપર બહુમતી જીતી હતી, જે ગુજરાતના ઇતિહાસમાં કોઈપણ પક્ષ દ્વારા જીતવામાં આવેલી સૌથી વધુ છે. ભારતીય રાષ્ટ્રીય કોંગ્રેસ રાજ્યમાં તેની 3 દાયકાની સૌથી નીચી ગણતરીમાં આવી ગઈ, અને આમ આદમી પાર્ટીને પાંચ બેઠકો મળી.",Politics
2012ની ગોવાની ચૂંટણીમાં કઈ પાર્ટીએ ભારતીય રાષ્ટ્રીય કોંગ્રેસને હરાવ્યું હતું?,"2012ની ચૂંટણીમાં, ભારતીય જનતા પાર્ટી (BJP) એ ગોવામાં ભારતીય રાષ્ટ્રીય કોંગ્રેસ સરકારને હરાવ્યું, જેની આગેવાની સીએમ દિગંબર કામત હતી. આ ચૂંટણી ભાજપ-મહારાષ્ટ્રવાદી ગોમંતક ગઠબંધન દ્વારા જીતવામાં આવી હતી જેણે 40 બેઠકોની વિધાનસભામાં 24 બેઠકો જીતી હતી.",Politics
ગુજરાતમાં કુલ કેટલા મતદારક્ષેત્રો છે?,182,Politics
