Question,Answer,Domain
" ""नाटकीय विडंबना"" शब्द को परिभाषित करें।"," नाटकीय विडंबना विडंबना का एक रूप है जो किसी कृति की संरचना के माध्यम से व्यक्त होती है: किसी कृति के पात्रों की स्थिति के बारे में दर्शकों की जागरूकता पात्रों की जागरूकता से काफी भिन्न होती है, और इसलिए पात्रों के शब्द और कार्य दर्शकों के लिए कृति के पात्रों की तुलना में भिन्न - अक्सर विरोधाभासी - अर्थ ग्रहण करते हैं।",Literature
 बिल्डुंग्सरोमन शैली का क्या महत्व है?," साहित्यिक आलोचना में, बिल्डुंग्सरोमन एक साहित्यिक शैली है जो बचपन से वयस्कता (वयस्कता) तक नायक के मनोवैज्ञानिक और नैतिक विकास पर केंद्रित है,[1] जिसमें चरित्र परिवर्तन महत्वपूर्ण है",Literature
 साहित्यिक कृति के वातावरण में परिवेश किस प्रकार योगदान देता है?,"कहानी के मूड को आकार देने में सेटिंग भी बड़ी भूमिका निभा सकती है। उदाहरण के लिए, एक अंधेरा और उदास सेटिंग बेचैनी और तनाव की भावना पैदा कर सकती है, जबकि एक धूप और खुशनुमा सेटिंग शांति और खुशी की भावना पैदा कर सकती है।",Literature
" ""चेतना की धारा"" कथन की अवधारणा को समझाइए।", चेतना की धारा एक कथात्मक शैली है जो किसी पात्र की विचार प्रक्रिया को यथार्थवादी तरीके से पकड़ने का प्रयास करती है।,Literature
 साहित्य में अविश्वसनीय कथावाचक की भूमिका क्या है?, अविश्वसनीय कथावाचक वह कहानीकार होता है जिसकी कहानी पर पूरी तरह से भरोसा नहीं किया जा सकता। कभी-कभी अविश्वसनीय कथावाचक जानबूझकर पाठक से जानकारी छिपाता है या गुमराह करने की कोशिश करता है; दूसरी बार कथावाचक की अविश्वसनीयता उसके नियंत्रण से बाहर होती है।,Literature
 अंतरपाठीयता किसी साहित्यिक कृति को किस प्रकार समृद्ध बनाती है?," लेखक आलोचनात्मक या अतिरिक्त अर्थ सृजित करने, कोई मुद्दा स्पष्ट करने, हास्य उत्पन्न करने, या यहां तक कि किसी मूल कार्य की पुनर्व्याख्या करने के लिए अंतरपाठीयता का उपयोग कर सकते हैं।",Literature
" ""फ़ॉइल कैरेक्टर"" शब्द को परिभाषित करें।", पन्नी चरित्र एक साहित्यिक तत्व है जो मुख्य चरित्र या नायक के विपरीत कार्य करता है।,Literature
 त्रासदी और हास्य में क्या अंतर है?," कॉमेडी एक सुखद अंत वाली हास्य कहानी है, जबकि त्रासदी एक दुखद अंत वाली गंभीर कहानी है।",Literature
" नाट्य साहित्य में ""रेचन"" की अवधारणा को समझाइए।", कैथार्सिस कला के माध्यम से मजबूत या दबी हुई भावनाओं को बाहर निकालने की प्रक्रिया है,Literature
 किसी कथा में पूर्वाभास का उद्देश्य क्या है?," पूर्वाभास एक कथानक तत्व है जो कहानी में आगे आने वाली किसी बात का संकेत देता है। लेखन में पूर्वाभास का उपयोग करने के कई कारण हैं, जिसमें रहस्य पैदा करना, जिज्ञासा जगाना और अपने पाठक को उस “अहा” पल के लिए तैयार करना शामिल है।",Literature
 कविता में विशिष्ट प्रभाव उत्पन्न करने के लिए अनुप्रास का प्रयोग किस प्रकार किया जाता है?," अनुप्रास शब्दों की एक श्रृंखला के आरंभ में एक ही ध्वनि को लगातार दोहराने को अनुप्रास कहते हैं, जिसका उद्देश्य एक श्रव्य स्पंदन प्रदान करना होता है, जो रचना को एक मधुर, गीतमय और/या भावपूर्ण प्रभाव प्रदान करता है।",Literature
 सॉनेट की संरचना समझाइए," अंग्रेजी सॉनेट्स आमतौर पर तीन क्वाट्रेन (4-पंक्ति छंद) से बनते हैं, जिसके बाद एक तुकांत दोहे होते हैं",Literature
"""मानवीकरण"" शब्द को परिभाषित करें।"," मानवीकरण को ""साहित्यिक या कलात्मक प्रभाव के लिए वस्तुओं, अमूर्त विचारों आदि में मानवीय विशेषताओं का समावेश"" और ""कला और साहित्य में किसी व्यक्ति, प्राणी आदि के रूप में अमूर्त गुणवत्ता या विचार का प्रतिनिधित्व"" के रूप में परिभाषित किया गया है।",Literature
" ""भारतीय अंग्रेजी साहित्य का जनक"" किसे माना जाता है?", मुल्क राज आनंद,Literature
 वाल्मीकि द्वारा लिखित महाकाव्य का नाम बताइए।, रामायण,Literature
 भारतीय साहित्य में भक्ति आंदोलन का क्या महत्व है?,"उन्होंने सभी विभिन्न हिंदू देवताओं की एकता, ईश्वर के प्रति आत्म समर्पण, सभी लोगों की समानता और भाईचारे तथा जीवन की पहली प्राथमिकता के रूप में ईश्वर के प्रति समर्पण पर जोर दिया।",Literature
 किस भारतीय लेखक ने साहित्य में नोबेल पुरस्कार जीता?, रवींद्रनाथ टैगोर नोबेल पुरस्कार प्राप्त करने वाले भारत और एशिया के पहले व्यक्ति बने।,Literature
"रवीन्द्रनाथ टैगोर की ""गीतांजलि"" का केंद्रीय विषय क्या है?", रहस्यवाद,Literature
" मराठी साहित्य में ""बाखर"" शैली का क्या महत्व है?", मराठा शासक छत्रपति शिवाजी महाराज के कार्यों का वर्णन।,Literature
देशभक्ति और सामाजिक विषयों के लिए जाने जाने वाले एक प्रसिद्ध मराठी कवि का नाम बताइए।, फकीर चंद भारती,Literature
 कौन सा मराठी उपन्यास ब्रिटिश राज के सामाजिक और राजनीतिक मुद्दों की पड़ताल करता है?, राम धारी,Literature
" मराठी उपन्यास ""मानिनी"" के लेखक कौन हैं?", एन.एस. फड़के,Literature
" रवीन्द्रनाथ टैगोर के बंगाली उपन्यास ""गोरा"" का मुख्य विषय क्या है?"," राष्ट्रवाद, पहचान और सामाजिक सुधार।",Literature
"तमिल उपन्यास ""सिलप्पाधिकारम"" के लेखक कौन हैं?", इलांगो अडिगाल,Literature
 प्रकृति और आध्यात्मिकता पर अपनी रचनाओं के लिए जाने जाने वाले एक प्रसिद्ध मलयालम कवि का नाम बताइए।, सुगथकुमारी,Literature
" हिंदी साहित्य में ""प्रेमचंद युग"" का क्या महत्व है?"," प्रेमचंद की रचनाएँ दलितों, महिलाओं और किसानों जैसे हाशिए के समूहों द्वारा सामना किए जाने वाले संघर्षों और कठिनाइयों को चित्रित करती हैं, तथा राष्ट्रीय मुद्दों के समाधान के लिए सामाजिक सद्भाव की आवश्यकता पर बल देती हैं।",Literature
" कन्नड़ उपन्यास ""वंशवृक्ष"" के लेखक कौन हैं?", एस.एल. भैरप्पा,Literature
 साहित्य में भारतीय नव लहर आंदोलन का क्या महत्व है?," नई लहर से पहले, लोकप्रिय हिंदी सिनेमा ने हिंदी साहित्य को पूरी तरह से नज़रअंदाज़ कर दिया था, और इसके बजाय संकर, काव्यात्मक भाषा के लिए उर्दू की ओर रुख किया जिसमें प्रेम, आस्था और न्याय की बात की गई थी। भारतीय नई लहर ने साहित्यिक हिंदी के संस्कृत नवशब्दों को सिनेमा में लाया पहली बार सिनेमाघरों में प्रदर्शित किया गया।",Literature
"अरुंधति रॉय के उपन्यास ""द गॉड ऑफ स्मॉल थिंग्स"" का विषय क्या है?"," अरुंधति रॉय की द गॉड ऑफ स्मॉल थिंग्स भारत के दो जुड़वां भाई-बहनों के बारे में है, जिनका जीवन उनके अतीत की त्रासदियों से प्रभावित है। महत्वपूर्ण विषयों में परिवार, वफ़ादारी, वर्जित प्रेम, उपनिवेशवाद/उपनिवेशवाद के बाद, शिक्षा में भेदभाव और सामाजिक वर्ग असमानता शामिल हैं।",Literature
 भारत में दलित साहित्य आंदोलन का क्या महत्व है?, दलित साहित्य भारतीय समाज के जाति-आधारित ढांचे के भीतर दलित समुदाय के मार्मिक सामाजिक और राजनीतिक अनुभवों को व्यक्त करने के लिए एक सशक्त माध्यम के रूप में कार्य करता है। यह दलितों के जीवन को आकार देने वाले असंख्य सामाजिक कारकों और दलित और गैर-दलित दोनों के साथ उनके संबंधों पर प्रकाश डालता है। -दलित समुदाय.,Literature
 जीडीपी को परिभाषित करें। कल्याणकारी उपाय के रूप में इसके घटकों और सीमाओं की व्याख्या करें।," जीडीपी का मतलब सकल घरेलू उत्पाद है। यह किसी देश की सीमाओं के भीतर एक निश्चित अवधि में उत्पादित सभी वस्तुओं और सेवाओं के कुल मूल्य का माप है, आमतौर पर सालाना या तिमाही। कल्याण का मतलब समाज के भीतर व्यक्तियों की समग्र भलाई और जीवन की गुणवत्ता से है।",Economics
मुद्रास्फीति का कारण क्या है? इसके प्रभावों और नीतिगत प्रतिक्रियाओं पर चर्चा करें।," अधिक नौकरियाँ और उच्च वेतन घरेलू आय में वृद्धि करते हैं और उपभोक्ता व्यय में वृद्धि करते हैं, जिससे कुल मांग में वृद्धि होती है और फर्मों के लिए अपने माल और सेवाओं की कीमतें बढ़ाने की गुंजाइश होती है। जब यह बड़ी संख्या में व्यवसायों और क्षेत्रों में होता है, तो इससे मुद्रास्फीति में वृद्धि होती है।",Economics
"बेरोज़गारी को परिभाषित करें। इसके प्रकार, कारण और नीतिगत समाधानों का विश्लेषण करें।"," बेरोज़गारी तब होती है जब काम करने के इच्छुक कर्मचारी नौकरी पाने में असमर्थ होते हैं। बेरोज़गारी की उच्च दर आर्थिक संकट का संकेत देती है जबकि बेरोज़गारी की अत्यंत कम दर अत्यधिक गर्म अर्थव्यवस्था का संकेत दे सकती है। बेरोज़गारी को घर्षण, चक्रीय, संरचनात्मक या संस्थागत के रूप में वर्गीकृत किया जा सकता है।",Economics
भुगतान संतुलन की व्याख्या करें। इसके घटकों और इसे प्रभावित करने वाले कारकों पर चर्चा करें।," भुगतान संतुलन (बीओपी) वह विधि है जिसके द्वारा देश एक निश्चित अवधि के भीतर सभी अंतरराष्ट्रीय मौद्रिक लेनदेन को मापते हैं। बीओपी में तीन मुख्य खाते होते हैं: चालू खाता, पूंजी खाता और वित्तीय खाता।",Economics
राजकोषीय नीति क्या है? स्थिरीकरण में इसके उपकरण और प्रभावशीलता की व्याख्या करें," राजकोषीय नीति से तात्पर्य सार्वजनिक व्यय, कराधान और सार्वजनिक ऋण के संबंध में सरकारी नीति से है। यह वह साधन है जिसके द्वारा सरकार किसी देश की अर्थव्यवस्था की निगरानी और उसे प्रभावित करने के लिए अपने व्यय स्तर और कर दरों को समायोजित करती है।",Economics
लोच को परिभाषित करें। आर्थिक निर्णयों में इसके प्रकार और महत्व को समझाएँ।, लोच एक आर्थिक अवधारणा है जिसका उपयोग किसी वस्तु या सेवा की कीमत में होने वाले उतार-चढ़ाव के संबंध में उसकी कुल मांग में होने वाले परिवर्तन को मापने के लिए किया जाता है। किसी उत्पाद को लोचदार तब माना जाता है जब उसकी कीमत बढ़ने या घटने पर उत्पाद की मात्रा की मांग आनुपातिक रूप से अधिक बदलती है।,Economics
पूर्ण प्रतिस्पर्धा की व्याख्या करें। अल्पावधि और दीर्घावधि संतुलन का विश्लेषण करें।," अल्पावधि में, संतुलन मांग से प्रभावित होगा। दीर्घावधि में, किसी उत्पाद की मांग और आपूर्ति दोनों ही पूर्ण प्रतिस्पर्धा में संतुलन को प्रभावित करेंगे। एक फर्म को दीर्घावधि में संतुलन बिंदु पर केवल सामान्य लाभ प्राप्त होगा।",Economics
"एकाधिकार को परिभाषित करें। इसकी विशेषताओं, मूल्य निर्धारण और सामाजिक लागतों की व्याख्या करें।"," एकाधिकार एक प्रकार की बाजार संरचना है जिसमें एक ही कंपनी और उसके सामान और सेवाएँ हर समय बाजार पर हावी रहती हैं। एकाधिकार बाजार की कुछ प्रमुख विशेषताओं में एकल विक्रेता की उपस्थिति, उच्च प्रवेश बाधाएँ, मूल्य अकुशल मांग और विकल्पों की कमी शामिल है।",Economics
अल्पाधिकार को परिभाषित करें। इसकी विशेषताओं और मूल्य निर्धारण रणनीतियों की व्याख्या करें।," अल्पाधिकार तब होता है जब कुछ कंपनियाँ किसी दिए गए बाज़ार पर महत्वपूर्ण नियंत्रण रखती हैं। साथ मिलकर, ये कंपनियाँ एक-दूसरे के साथ मिलीभगत करके कीमतों को नियंत्रित कर सकती हैं, जिससे अंततः बाज़ार में अप्रतिस्पर्धी कीमतें उपलब्ध होती हैं।",Economics
बाह्यताएँ क्या हैं? सकारात्मक और नकारात्मक बाह्यताएँ तथा उनके निहितार्थों के बीच अंतर बताइए।," आर्थिक लेन-देन के अप्रत्यक्ष प्रभाव जो उन लोगों को प्रभावित करते हैं जो सीधे लेन-देन में शामिल नहीं होते हैं। नकारात्मक बाह्यता तब होती है जब लागत फैल जाती है। सकारात्मक बाह्यता तब होती है जब लाभ फैल जाता है। इसलिए, बाह्यता तब होती है जब लेन-देन की कुछ लागत या लाभ उत्पादक या उपभोक्ता के अलावा किसी और पर पड़ते हैं।",Economics
किस शहर को उसके ऑटोमोबाइल उद्योग के लिए “भारत का डेट्रायट” कहा जाता है?, चेन्नई को “एशिया का डेट्रायट” (या “भारत का डेट्रायट”) उपनाम दिया गया है। ऐसा शहर के आसपास प्रमुख ऑटोमोबाइल विनिर्माण इकाइयों और संबद्ध उद्योगों की मौजूदगी के कारण है। अमेरिका में अधिकांश ऑटोमोबाइल विनिर्माण उद्योग अमेरिका के आसपास ही हैं।,Economics
 मूल्यानुसार कर (ऐड वैलोरम टैक्स) किसके लिए लगाया जाता है?, वस्तु की कीमत,Economics
 लीड बैंक योजना को किस गहन विकास को अपनाने के लिए अंतिम रूप दिया गया?, कृषक समुदाय की सहायता करने के उद्देश्य से गांव स्तर पर तैयारी अपनाने के लिए अग्रणी बैंक योजना को अंतिम रूप दिया गया।,Economics
