Question,Answer,Domain
 हेमाडपंती मंदिर की बाहरी दीवारों की विशेषताएँ क्या हैं?, हेमाडपंती मंदिर की बाहरी दीवारें अक्सर तारे के आकार की होती हैं। तारा मंदिर निर्माण में मंदिर की बाहरी दीवार को कई कोणों में विभाजित किया जाता है। इसलिए आप दीवारों पर छाया और उस पर बनी मूर्तियों का सुंदर प्रभाव देख सकते हैं। हेमाडपंती मंदिरों की एक महत्वपूर्ण विशेषता यह है कि दीवार के पत्थरों को बनाने में चूने का उपयोग नहीं किया जाता है। दीवार को घुमावदार खांचे और क्यूप्स के आधार पर बनाया गया है जो पत्थरों में कसकर फिट होते हैं।,History
'किताब-ए-नवरस' पुस्तक किसने लिखी?, इब्राहीम आदिल शाह द्वितीय 'किताब-ए-नवरस' पुस्तक के लेखक थे।,History
 प्रथम मराठी समाचार पत्र 'दर्पण' के संपादक कौन थे?,पहले मराठी समाचार पत्र 'दर्पण' के संपादक बालशास्त्री जांभेकर को मराठी पत्रकारिता में पहले संपादक के रूप में जाना जाता है।,History
 भारत सरकार द्वारा 1950 में कौन सा बोर्ड स्थापित किया गया था जिसके अध्यक्ष प्रधानमंत्री पंडित जवाहरलाल नेहरू थे?, 1950 में भारत सरकार ने योजना बोर्ड की स्थापना की। प्रधानमंत्री पंडित जवाहरलाल नेहरू इस बोर्ड के अध्यक्ष थे।,History
 किस शासक ने राजनीति पर 'सभानीति' पुस्तक प्रकाशित की?,"'सभानीति' पुस्तक छत्रपति प्रताप सिंह महाराज द्वारा प्रकाशित की गई थी। यह पुस्तक राजनीति, प्रशासन और सत्ता से संबंधित विचारों की दृष्टि से महत्वपूर्ण मानी जाती है।",History
 1905 में 'भारत सेवक समाज' की स्थापना किसने की?, नामदार गोपाल कृष्ण गोखले ने 1905 में 'भारत सेवक समाज' की स्थापना की।,History
 सावरकर की आत्मकथा का नाम क्या था?, सावरकर ने अंडमान के उन भयावह दिनों के अनुभवों को अपनी आत्मकथा 'माझी जन्मथेप' में लिखा है।,History
 अमलनेर मिल श्रमिक यूनियन के अध्यक्ष कौन थे?, साने गुरुजी अमलनेर में मिल मजदूर यूनियन के अध्यक्ष थे।,History
 राजकोट में रेड क्रॉस सोसाइटी की स्थापना किसने की?, रख्माबाई जनार्दन सावे ने राजकोट में रेड क्रॉस सोसाइटी की स्थापना की।,History
 AITUC के प्रथम अधिवेशन की अध्यक्षता किसने की?, AITUC की स्थापना भारत के सभी मज़दूरों को राष्ट्रीय स्तर पर एकजुट करने के लिए की गई थी। लाला लाजपत राय इसके पहले अधिवेशन के अध्यक्ष थे।,History
 भारत की अनंतिम सरकार का प्रमुख कौन था?,स्वतंत्र भारत की अनंतिम सरकार में राज्य प्रमुख के रूप में सुभाष चंद्र बोस की अध्यक्षता में एक मंत्रिमंडल शामिल था।,History
 भारत और पाकिस्तान नामक दो स्वतंत्र राष्ट्र बनाने की योजना किसने तैयार की?, लॉर्ड माउंटबेटन ने भारत और पाकिस्तान को दो स्वतंत्र राष्ट्र बनाने की योजना तैयार की।,History
 मई 1960 को किस राज्य का गठन हुआ?, महाराष्ट्र,History
 पुणे में कौन सा गांधी स्मारक संग्रहालय गांधीजी के इतिहास के बारे में जानकारी प्रदान करता है?," पुणे के आगा खान पैलेस में हम महात्मा गांधी के जीवन के बारे में जानकारी देने वाली विभिन्न वस्तुएं, दस्तावेज देख सकते हैं।",History
 1453 ई. में ओटोमन तुर्कों ने किस शहर पर विजय प्राप्त की थी?, कांस्टेंटिनोपल (आधुनिक इस्तांबुल) शहर पर 1453 में ओटोमन तुर्कों ने विजय प्राप्त की थी।,History
 अंग्रेजों के अवैध व्यापार पर अंकुश लगाने का प्रयास किसने किया?, मीर जाफ़र अंग्रेजों के समर्थन से बंगाल का नवाब बना लेकिन बाद में उसने अंग्रेजों के खिलाफ़ विरोध करना शुरू कर दिया और इसलिए उसके दामाद मीर कासिम को नवाब बना दिया गया। मीर कासिम ने अंग्रेजों के अवैध व्यापार पर प्रतिबंध लगाने की कोशिश की और इसलिए एक बार फिर मीर जाफ़र को बंगाल का नवाब बना दिया गया।,History
1802 में किस पेशवा ने अंग्रेजों के साथ सैन्य समझौते पर हस्ताक्षर किए?, बाजी राव द्वितीय ने 31 दिसंबर 1802 को बेसीन की संधि पर हस्ताक्षर किये।,History
जमशेदजी टाटा ने टाटा आयरन एंड स्टील कंपनी का इस्पात विनिर्माण संयंत्र किस स्थान पर स्थापित किया?, टाटा आयरन एंड स्टील कंपनी (टिस्को) की स्थापना जमशेदजी टाटा ने की थी और इसकी स्थापना दोराबजी टाटा ने जमशेदपुर में की थी।,History
 गीतारहस्य पुस्तक किस लेखक ने लिखी?," लोकमान्य बालगंगाधर तिलक ने मंडाले की जेल में श्रीमद्भगवद्गीता रहस्य की रचना की - जो भगवद्गीता में कर्म योग का विश्लेषण है, जिसे वेदों और उपनिषदों की देन माना जाता है।",History
 रवींद्रनाथ टैगोर ने जलियांवाला बाग हत्याकांड के विरोध में सरकार द्वारा दी गई कौन सी उपाधि को त्याग दिया?, रवींद्रनाथ टैगोर को 1915 में किंग जॉर्ज पंचम द्वारा साहित्य में सेवाओं के लिए नाइटहुड की उपाधि से सम्मानित किया गया था। 1919 के जलियांवाला बाग हत्याकांड के बाद टैगोर ने नाइटहुड की अपनी उपाधि त्याग दी थी।,History
"किस भोसले राष्ट्रपति ने अंग्रेजों के साथ ""नागपुर की संधि"" पर हस्ताक्षर किए?", नागपुर की संधि 1816 में भोसले के राष्ट्रपति अप्पा साहेब और ब्रिटिश गवर्नर-जनरल लॉर्ड हेस्टिंग्स के बीच हुई थी।,History
" किस वर्ष जनरल वेलेस्ली ने अहमदनगर किले पर कब्जा कर लिया, जिससे इस क्षेत्र में ब्रिटिश शक्ति को बढ़ावा मिला?","1803 में जनरल वेलेस्ली ने अहमदनगर किले पर कब्जा कर लिया, जिससे इस क्षेत्र में ब्रिटिश शक्ति बढ़ गयी।",History
 शिवाजी महाराज का राज्याभिषेक किस वर्ष हुआ था?, शिवाजी महाराज का राज्याभिषेक 1674 में हुआ था।,History
 खानदेश क्षेत्र पर मुगल सम्राट अकबर ने किस वर्ष कब्जा किया था?,खानदेश क्षेत्र पर 1601 में मुगल सम्राट अकबर ने कब्जा कर लिया था।,History
 पानीपत की तीसरी लड़ाई में मराठों को किसने हराया?, 1761 में पानीपत के तीसरे युद्ध में अहमद शाह अब्दाली के नेतृत्व में दुर्रानी साम्राज्य ने मराठों को पराजित कर दिया।,History
किस मराठा राजा के दरबारी कवि ने वीर महाकाव्य शिवभारत की रचना की थी?, वीर महाकाव्य शिवभारत की रचना छत्रपति शिवाजी महाराज के दरबारी कवि ने की थी।,History
 वडगांव समझौता या संधि किस युद्ध के बीच हुई थी?, वडगांव समझौता प्रथम आंग्ल-मराठा युद्ध के दौरान हुआ था।,History
शेरशाह के शासनकाल में राजस्व खाते किस भाषा में लिखे जाते थे?, शेरशाह के शासनकाल के दौरान राजस्व खाते फ़ारसी और हिंदवी में बनाए रखे जाते थे।,History
 गाविलगढ़ किला 1425 ई. में किस राजा द्वारा बनवाया गया था?, गाविलगढ़ किले का निर्माण अहमद शाह बहमनी ने 1425 ई. में करवाया था।,History
" भारत सरकार द्वारा अपनाए गए राज्य प्रतीक में ""सत्यमेव जयते"" शब्द किस उपनिषद से लिए गए हैं?"," ""सत्यमेव जयते"" शब्द मुण्डकोपनिषद् से लिये गये हैं।",History
 मौर्य साम्राज्य का अंत अंततः कैसे हुआ?, मौर्य साम्राज्य का अंत तब हुआ जब अंतिम मौर्य शासक की उसके सेनापति ने हत्या कर दी।,History
कैलाश मंदिर किस गुफा में स्थित है?, कैलाश मंदिर एलोरा गुफाओं में स्थित है।,History
जवाहरलाल नेहरू की अध्यक्षता में लाहौर कांग्रेस ने भारत के लिए 'पूर्ण स्वराज' या पूर्ण स्वतंत्रता की मांग को औपचारिक रूप कब दिया?, 'पूर्ण स्वराज' की मांग को दिसंबर 1929 में लाहौर कांग्रेस में औपचारिक रूप दिया गया।,History
कौन से एंग्लो-मराठा युद्धों के परिणामस्वरूप पेशवाओं के क्षेत्रों को बॉम्बे प्रेसीडेंसी में मिला दिया गया?, तृतीय आंग्ल-मराठा युद्ध के परिणामस्वरूप पेशवाओं के क्षेत्रों को बॉम्बे प्रेसीडेंसी में मिला दिया गया।,History
 गांधी-इरविन समझौता भारत के निम्नलिखित में से किस आंदोलन से संबंधित था?, गांधी-इरविन समझौता सविनय अवज्ञा आंदोलन से जुड़ा था।,History
मराठा साम्राज्य के इतिहास में खरदा के युद्ध के महत्व का वर्णन करें।, खरदा की लड़ाई 11 मार्च 1795 को मराठा साम्राज्य और हैदराबाद के निज़ाम के बीच हुई थी। मराठों ने निर्णायक जीत हासिल की। इस लड़ाई का एक महत्वपूर्ण प्रभाव पड़ा क्योंकि अंग्रेज मराठा प्रभुत्व को गंभीरता से लेंगे .,History
 जॉयस ने यूलिसिस में चेतना-प्रवाह का उपयोग किस प्रकार किया है?," जॉयस पारंपरिक कथात्मक संरचना को दरकिनार करते हुए, पात्रों के मन में गहराई तक उतरने के लिए चेतना की धारा का उपयोग करते हैं।",Literature
 द ग्रेट गैट्सबी में हरे प्रकाश के महत्व का विश्लेषण करें।," एफ. स्कॉट फिट्ज़गेराल्ड की द ग्रेट गैट्सबी में डेज़ी के डॉक के अंत में हरी रोशनी जे गैट्सबी के अमर प्रेम, हताशा और अमेरिकी सपने को प्राप्त करने में असमर्थता का प्रतीक है। कहानी जैज़ युग के दौरान न्यूयॉर्क में सेट की गई है।",Literature
 वुदरिंग हाइट्स में सेटिंग की क्या भूमिका है?," वुदरिंग हाइट्स की सेटिंग और स्थान, जिसे अक्सर विश्वासघाती बताया जाता है, उपन्यास में अंधेरे स्वर और परेशान करने वाली कथानक घटनाओं को मजबूत करता है। घर खुद एक अलग और जीर्ण पत्थर की हवेली है जिसमें विचित्र नक्काशी है। थ्रशक्रॉस ग्रेंज, जहाँ उपन्यास के कुछ हिस्से घटित होते हैं, हाइट्स की तरह ही अलग-थलग है।",Literature
 शेक्सपियर ने हेमलेट में लैंगिक भूमिकाओं को किस प्रकार उलट दिया है?,"गर्ट्रूड: रानी के रूप में, वह सत्ता की स्थिति में है, लेकिन उसका जल्दबाजी में किया गया पुनर्विवाह और अस्पष्ट चित्रण शोकग्रस्त विधवा के आदर्श को जटिल बनाता है। उसका चरित्र अक्सर महिलाओं को सौंपी जाने वाली निष्क्रिय भूमिका पर सवाल उठाता है। ओफेलिया: जबकि अक्सर उसे एक नाजुक और आज्ञाकारी महिला के रूप में दर्शाया जाता है, उसका पागलपन और दुखद अंत महिलाओं पर पितृसत्तात्मक बाधाओं के विनाशकारी प्रभाव को उजागर करता है। हेमलेट: राजकुमार खुद पारंपरिक रूप से मर्दाना और स्त्रैण गुणों का एक जटिल अंतर्संबंध प्रदर्शित करता है, जिसमें अनिर्णय, उदासी और दार्शनिक चिंतन शामिल है, जो लिंग भूमिकाओं की कठोर सीमाओं को चुनौती देता है। इन पात्रों के माध्यम से, शेक्सपियर एलिज़ाबेथन समाज में लिंग और उसकी जटिलताओं की सूक्ष्म खोज प्रस्तुत करता है।",Literature
 लॉर्ड ऑफ द फ्लाईज़ में आँख के प्रतीकवाद का विश्लेषण करें।," लॉर्ड ऑफ द फ्लाईज़ का संदेश मानव स्वभाव में मौजूद द्वंद्व से संबंधित है जो लोगों को सभ्य, संगठित और शांतिपूर्ण बनाता है, लेकिन साथ ही अराजकतावादी, हिंसक और बर्बर भी बनाता है। लड़के शुरू में सहयोगी और सभ्य होते हैं, लेकिन द्वीप पर अपने समय के दौरान वे बिगड़ जाते हैं, और ज़्यादातर बर्बर और अराजकतावादी बन जाते हैं।",Literature
 लोलिता में अविश्वसनीय कथावाचक की अवधारणा पर चर्चा करें।," एक अविश्वसनीय कथाकार के रूप में हम्बर्ट पाठक को प्रभावित करने के लिए कई अलग-अलग तरीकों का इस्तेमाल करता है। कई मौकों पर अपने पागलपन को बढ़ा-चढ़ाकर पेश करते हुए, वह परोक्ष रूप से अपने जीवन पर नियंत्रण खोने और इस तरह जिम्मेदारी से बचने की भावना को व्यक्त करने की कोशिश करता है।",Literature
" टॉम ने अपने कानों के पीछे से पानी धोया है या नहीं, यह जांचने के लिए आंटी पोली क्या प्रयोग करती हैं?", आंटी पोली गीले तौलिये का उपयोग यह जांचने के लिए करती हैं कि टॉम ने अपने कान के पीछे का भाग धोया है या नहीं।,Literature
 इंडियन जो डॉ. रॉबिन्सन के साथ क्या करता है?," तीनों लोगों के बीच लड़ाई के बाद, जिसमें मफ पॉटर बेहोश हो जाता है, इंडियन जो डॉ. रॉबिन्सन पर मफ के चाकू से वार करता है। हक और टॉम भाग जाते हैं और इंडियन जो को नशे में धुत मफ को यह समझाते हुए नहीं सुनते कि वह हत्यारा है।",Literature
 हेमलेट के पिता की मृत्यु कैसे हुई?," मैं तुम्हारे पिता की आत्मा हूँ,' भूत हेमलेट से कहता है। यह उसे बताता है कि हेमलेट के पिता की मृत्यु स्वाभाविक रूप से नहीं हुई थी, बल्कि उनके भाई क्लॉडियस ने उनकी हत्या कर दी थी। जब राजा सो रहा था, क्लॉडियस ने उसके कान में ज़हर डाल दिया, जिससे राजा की दर्दनाक मौत हो गई। भूत हेमलेट को क्लॉडियस से उसके पिता की हत्या का बदला लेने के लिए कहता है।",Literature
 मूल भाव और प्रतीक में क्या अंतर है?, मूल भावों को पूरी कहानी में दोहराया जाना चाहिए; प्रतीक केवल एक बार ही दिखाई दे सकते हैं,Literature
