Question,Answer,Domain
"2015 के बिहार चुनाव मे प्रमुख कारक की छल, जेकर पहचान सामाजिक इतिहासकार बद्री नारायण केने छथि?","हिन्दुत्व राजनीति क॑ जातिगत राजनीति के सामना करना छेलै जैसनऽ कि सामाजिक इतिहासकार बद्री नारायण न॑ कहलकै, जेकरा म॑ २०१५ केरऽ राजनीतिक उथल-पुथल क॑ बहुत क्षेत्रीय राजनीतिक दल आरू नेता सिनी के सामने आबै वाला चुनौती के हिस्सा के रूप म॑ पहचानलऽ गेलै जेकरा सब क॑ भीतर के विशिष्ट जाति समूह के समर्थन मिललै अपन राज्य।",Politics
भारतीय राष्ट्रीय विकास समावेशी गठबंधन (INDIA) के गठन के पाछु की प्रेरणा छल?,एकरऽ प्रेरणा २०१४ आरू २०१९ केरऽ आम चुनाव म॑ विपक्ष केरऽ एनडीए क॑ हराबै म॑ असमर्थता के बाद २०२४ केरऽ आम चुनाव म॑ भाजपा नेतृत्व वाला एनडीए के खिलाफ खड़ा होय लेली लगभग सब बड़ऽ राजनीतिक दल केरऽ भव्य गठबंधन के जरूरत छेलै ।,Politics
फ्रीडम हाउस न॑ २०२३ म॑ भारतीय लोकतंत्र केरऽ दशा क॑ कोना वर्गीकृत करलकै ?,2023 म॑ फ्रीडम हाउस केरऽ फ्रीडम इन द वर्ल्ड रिपोर्ट म॑ लगातार तेसरऽ साल भारत क॑ “आंशिक रूप स॑ स्वतंत्र” देश के रूप म॑ वर्गीकृत करलऽ गेलऽ छेलै ।,Politics
चुनाव आयोग कोन कानून के तहत संचालित अछि?,निर्वाचन आयोग संविधानक अनुच्छेद ३२४ आ तत्पश्चात बनल जनप्रतिनिधित्व अधिनियम द्वारा देल गेल अधिकारक अन्तर्गत संचालित होइत अछि ।,Politics
भारत आ ब्राजील के जलवायु के तुलना करू,"1. भारत मे मानसून प्रकारक जलवायु अछि जखन कि ब्राजील मे जलवायु मे बहुत रास भिन्नता होइत अछि । जेना कि ब्राजील में भूमध्य रेखा के पास जलवायु गर्म छै जबकि मकर राशि के उष्णकटिबंध के पास समशीतोष्ण प्रकार के जलवायु छै । 2. भारत में औसत तापमान साल भरि बेसी रहैत अछि कियाक त सूर्य के किरण ट्रॉपिक ऑफ कैंसर तक लंबवत रहैत अछि जे एहि स गुजरैत अछि जखन कि ब्राजील में भूमध्य रेखा देश के उत्तरी भाग के काटि लैत अछि जकर परिणाम 25"" C स 28 तक होइत अछि | ° अमेजन घाटी में औसत तापमान के 3. भारत के उत्तरी राज्यों में तापमान ठंडा है के लिये जम्मू एवं कश्मीर एवं पहाड़ी क्षेत्रों के कुछ भागों में जाड़ा के दौरान -40° C के तापमान का अनुभव होता है | भारत केरऽ दक्षिणी राज्यऽ के तरफ एकरऽ विपरीत ब्राजील केरऽ उत्तरी भाग म॑ सामान्यतः गरम होय छै जबकि दक्षिणी भाग म॑ तापमान अपेक्षाकृत कम होय छै 4. भारत म॑ दक्षिण-पश्चिम मानसून केरऽ हवा के कारण वर्षा होय छै आरू वर्षा मुख्य रूप स॑ ओरोग्राफिक केरऽ होय छै प्रकार जखन कि ब्राजील मे ओरोग्राफिक प्रकार के वर्षा दक्षिण-पूर्व व्यापार हवा & पूर्वोत्तर व्यापार हवा आ ब्राजील के उत्तरी भाग में वर्षा संवहनी प्रकार के होइत अछि 5. भारत में गुजरात आ राजस्थान के क्षेत्र में कम वर्षा होइत अछि | जबकि ब्राजील केरऽ हाईलैंड केरऽ उत्तर-पूर्वी भाग म॑ बहुत कम वर्षा होय छै । 6. भारत मे उष्णकटिबंधीय चक्रवात बेसी होइत अछि जखन कि ब्राजील मे ई चक्रवात बहुत कम होइत अछि ।",Geography
नर्मदा घाटी में गाढ़ बस्ती के कारण भेटैत अछि |,"नर्मदा उपत्यकामे नदीक समीप खेती योग्य जमीनक कारणेँ एकाग्र बस्ती भेटैत अछि । नर्मदा घाटी मुख्य रूप सँ गुजरात आ मध्य प्रदेश मे अवस्थित अछि, आ कोनो नदीक लगक जमीन बहुत खेती योग्य अछि |",Geography
किसानक कें हित मे सरकार दूवारा शुरू कैल गेल विभिन्न संस्थागत सुधार कार्यक्रमक कें भर्ती करूं.,"अन्य कारक जे बस्ती कें पैटर्न कें प्रभावित कयर सकय छै, ओय मे शामिल छै: पानी कें उपलब्धता, जमीन कें ढलान, आ जलवायु पैटर्न.",Geography
चावल के बढ़ने के लिये आवश्यक भौगोलिक स्थिति का वर्णन कीजिए |,भारत में प्रायः नर्मदा घाटी के पठार क्षेत्र में नाभिकीय बस्ती पाबै जाय छै ।,Geography
भारत दुनिया मे ............. के अग्रणी उत्पादक आ निर्यातक अछि |,चाय,Geography
पीला क्रांति के संदर्भित करैत अछि,तिलहन के उत्पादन बढ़ल।,Geography
चावल उत्पादन के मामला में भारत दुनिया में कोन स्थान पर अछि ?,दोसर,Geography
भारत मे कोयला के वितरण का वर्णन कीजिए।,"भारत म॑ कोयला दू मुख्य भूवैज्ञानिक युग केरऽ चट्टान श्रृंखला म॑ मिलै छै, यानी गोंडवाना, जेकरऽ उम्र २० करोड़ साल स॑ कुछ अधिक छै आरू तृतीयक जमा म॑ जे केवल लगभग ५.५ करोड़ साल पुरानऽ छै । गोंडवाना कोयला के प्रमुख संसाधन जे धातुकर्म कोयला छै, दामोदर घाटी (पश्चिम बंगाल-झारखंड) में स्थित छै. झरिया, रानीगंज, बोकारो महत्वपूर्ण कोयला क्षेत्र अछि। गोदावरी, महानदी, सोन आ वर्धा घाटी मे सेहो कोयला भंडार अछि । तृतीयक कोयला पूर्वोत्तर राज्य मेघालय, असम, अरुणाचल प्रदेश आ नागालैंड मे भेटैत अछि । झारखंड सबसँ पैघ उत्पादक अछि जतय झरिया, बोकारो, करमपुर , पलामू प्रमुख कोयला क्षेत्र अछि | पश्चिम बंगाल मे रानीगंज, जलपाईगुड़ी आ दार्जिलिंग कोयला क्षेत्र अछि । सरगुजा, बिलासपुर, रायगढ़ आ बस्तर जिला छत्तीसगढ़ मे पाओल जाय वाला कोयला खेत अछि । एमपी के चाइनावेयर जिला मे कोयला के खेत अछि आओर महाराष्ट्र मे चंदा मुख्य खेत अछि.",Geography
झारखंड के कोडरमा गया-हजरीबाग बेल्ट किस खनिज के प्रमुख उत्पादक है?,अभ्रक,Geography
भारतक सबसँ पुरान तेल उत्पादक राज्य कोन राज्य अछि ?,असम,Geography
भारत केरऽ सबसें समृद्ध खनिज पट्टी ....................,प्रायद्वीपीय पठार,Geography
शिरा आ लोड स कोन खनिज प्राप्त होइत अछि ?,"प्रमुख धातुक खनिज जेना टीन, तांबा, जस्ता आ सीसा आदि शिरा आ लोड सँ प्राप्त होइत अछि |",Geography
चिपको आन्दोलन के उद्देश्य की छल ?,वन संरक्षण,Geography
कोन वन्यजीव संरक्षण अधिनियम मे पहिल बेर पौधाक कें संरक्षित प्रजातियक कें सूची शामिल कैल गेल छै ?,वन्यजीव संरक्षण अधिनियम 1972,Geography
कोन माटि तीव्र लीचिंग स बनैत अछि,लैटराइट मिट्टी,Geography
औद्योगिक क्षेत्र कें कोन आधार पर सार्वजनिक आ निजी क्षेत्र मे वर्गीकृत कैल गेल छै?,उद्यमों के स्वामित्व,Geography
भारतक म्यानचेस्टरक नामसँ कोन शहर जानल जाइत अछि ?,अहमदाबाद,Geography
भारत मे स्टील के प्रति व्यक्ति खपत अछि,वर्ष 2022-23 क दौरान देश मे स्टील क खपत 119.89 मेट्रिक टन आ प्रति व्यक्ति स्टील क खपत 86.7 किलो रहल।,Geography
सिन्धु आ गंगा नदीक उत्पत्ति कतय अछि ?,"गंगा केरऽ हेडवाटर जेकरा ‘भागीरथी’ कहलऽ जाय छै, गंगोत्री ग्लेशियर केरऽ पोषण होय छै आरू उत्तरांचल केरऽ देवप्रयाग में अलकनंदा केरऽ जोड़ होय छै । हरिद्वार मे पहाड़ सँ गंगा मैदान मे निकलैत अछि | सिन्धु बाल्टिस्तान आ गिलगित होइत बहैत अछि आ अटॉक पर पहाड़सँ निकलैत अछि ।",Geography
कोन दू टा प्रायद्वीपीय नदी गर्त स बहैत अछि ?,"नर्मदा आ टैपी दू टा प्रायद्वीपीय नदी अछि, जे गर्त मे बहैत अछि ।",Geography
आजुक कोन-कोन महाद्वीप गोंडवाना भूमिक हिस्सा छल ?,"सबसँ पुरान भूखंड, (प्रायद्वीप भाग), गोंडवाना भूमिक एकटा हिस्सा छल । गोंडवाना भूमि में भारत, ऑस्ट्रेलिया, दक्षिण अफ्रीका आ दक्षिण अमेरिका एक एक भूमि द्रव्यमान के रूप में शामिल छल |",Geography
कोन दू देशक अंतरराष्ट्रीय सीमा सबसँ बेसी अछि ?,कनाडा आ अमेरिका,Geography
दुनिया के सबस घन आबादी वाला शहर की अछि ?,"मनीला, फिलीपींस",Geography
भारत मे कॉफी के सबस बेसी उत्पादक निम्नलिखित मे स कोन राज्य अछि ?,कर्नाटक,Geography
पृथ्वी पर सिरोही बिन्दु कतय स्थित अछि ?,अंटार्टिका,Geography
भारत केरऽ सबसें बड़ऽ अंतर्देशीय खारा आर्द्रभूमि प्रणाली कोन राज्य म॑ स्थित छै ?,राजस्थान,Geography
भारत के कुल क्षेत्रफल में कितना प्रतिशत गंगा नदी के कब्जा छै ?,26.30%,Geography
अलकनंदा नदी के उत्पत्ति कोन ग्लेशियर स भेल अछि ?,सतोपंथ ग्लेशियर,Geography
कोन नदी वुलर झील के पेट भरैत अछि ?,झेलम,Geography
व्हीलर द्वीप कोन द्वीपक पूर्व नाम छल ?,व्हीलर द्वीप अब्दुल कलाम द्वीप के पूर्व नाम छल । ई ओडिशाक तट पर अवस्थित अछि । रक्षा अनुसंधान आरू विकास संगठन (डीआरडीओ) केरऽ एकीकृत परीक्षण रेंज ई द्वीप प॑ स्थित छै ।,Geography
एकमात्र अभयारण्य कोन अछि जतय कश्मीर हरण भेटैत अछि ?,दचिगम नेशनल पार्क एकमात्र अभयारण्य अछि जतय कश्मीर हरण भेटैत अछि । ई कश्मीरमे अवस्थित अछि ।,Geography
भारत मे बायोस्फीयर रिजर्व प्रोग्राम कोन साल मे शुरू भेल छल ?,बायोस्फीयर रिजर्व कार्यक्रम भारत मे वर्ष 1986 मे शुरू भेल छल.भारत मे कुल 18 बायोस्फीयर रिजर्व अछि.,Geography
जीवाश्म आमतौर पर कोन प्रकारक चट्टान मे भेटैत अछि ?,जीवाश्म आमतौर पर अवसादी चट्टान मे बनैत अछि । जखन कोनो जीव मरि जाइत अछि आ तलछट मे दबि जाइत अछि तखन ई तलछट अंततः सख्त भ' जाइत अछि आ जीव जीवाश्म के रूप मे संरक्षित भ' जाइत अछि आ तलछटी चट्टान बनि जाइत अछि । एहि प्रक्रिया केँ जीवाश्मीकरण कहल जाइत छैक | आग्नेय आरू रूपांतरित चट्टान गर्मी या दबाव स॑ बनलऽ होय छै आरू जीवाश्म केरऽ नष्ट होय के संभावना छै ।,Geography
“मेडिसिन लाइन” अक्षांशक वृत्तक एकटा आओर नाम थिक ?,"49 वीं समानांतर केरऽ उपनाम मेडिसिन लाइन रखलऽ गेलै, कैन्हेंकि एकरऽ जादुई प्रतीत होय वाला क्षमता छेलै कि ई 1800 के दशक में अभियान के दौरान अमेरिकी सैनिकऽ क॑ एकरा पार करै स॑ रोकै छेलै । 49म समानांतर उत्तर यूरोप, एशिया, प्रशांत महासागर, उत्तरी अमेरिका आ अटलांटिक महासागर के पार करैत अछि ।",Geography
"चेनब नदी जे चन्द्रभाग के नाम सँ सेहो जानल जाइत अछि, चन्द्र आ भाग नदी के विलय के संग कोन स्थान के पास बनैत अछि ?","हिमाचल प्रदेश के लहौल स्पीटी जिला के टांडी में चन्द्रा आ भागा नदी के विलय के कारण चेनब नदी, जेकरा चंद्रभागा नदी सेहो कहल जाइत अछि, के निर्माण भेल अछि | चन्द्रा आ भगा नदी ४,८९१ मीटर के ऊंचाई पर बारालाचा दर्रा के विपरीत कात सँ उत्पन्न होइत अछि । ई सब २,२८६ मीटर के ऊंचाई पर टांडी में मिलै छै ।",Geography
कोन ग्रह केरऽ दिन केरऽ लम्बाई आरू ओकरऽ अक्ष केरऽ झुकाव पृथ्वी केरऽ लगभग समान छै ?,मंगल ग्रह,Geography
विश्वक सबसँ पैघ द्वीपीय देश कोन अछि ?,"इंडोनेशिया विश्व केरऽ सबसें बड़ऽ द्वीपीय देश छेकै, कैन्हेंकि एकरऽ क्षेत्रफल १,९०४,५६९ वर्ग किमी छै आरू एकरा म॑ १८,३०७ स॑ भी अधिक द्वीप शामिल छै । ई विश्व केरऽ सबसें अधिक जनसंख्या वाला द्वीपीय देश भी छेकै ।",Geography
पैघ नदीक सहायक नदी वाला घाटी के की कहल जाइत छैक ?,साइड घाटी एकटा एहन घाटी अछि जकर सहायक नदी एकटा पैघ नदीक अछि | पहाड़क लगक उच्च क्रमक घाटी थिक ।,Geography
“माबला पर्वत” कोन देश मे स्थित अछि ?,"माबला पर्वत, जेकरा मोंटी माबला के नाम स॑ भी जानलऽ जाय छै, जिबूती केरऽ ओबोक आरू ताडजोरा क्षेत्र म॑ स्थित एगो पर्वत श्रृंखला छेकै । ई पहाड़, जे जिबूती केरऽ पाँचमऽ सबसें ऊँचऽ बिंदु छेकै, म॑ स्थानिक जिबूती स्परफॉल आरू डे फॉरेस्ट नेशनल पार्क केरऽ निवास छै । ई उच्चभूमि क्षेत्र तद्जोरा के खाड़ी के उत्तरी भाग में, तटीय मैदान के पाछू, जहाँ लाल सागर अदन के खाड़ी स॑ मिलै छै, स्थित छै ।",Geography
सबसँ पहिने के बागान कतय आयल?,सबसँ पहिने के बागान अफ्रीका के गिनी तट के द्वीप पर 15वीं सदी के प्रतिष्ठान के अछि. ई व्यवस्था क॑ एत॑ स॑ उत्तरी ब्राजील म॑ पुर्तगाली सिनी न॑ गन्ना के उत्पादन लेली पहुँचाय देल॑ छेलै ।,Geography
शनिवार वाडा के निर्माण लागत कतेक छल?,"शनिवारवाड़ा 1732 मे पूरा भेल, जाहि पर कुल 1000 रुपया लागत। 16,110, जे ओहि समय मे बहुत पैघ रकम छल।",History
छत्रपति शाहू महाराजक राज कहिया शुरू भेल आ कहिया समाप्त भेल ?,छत्रपति शाहू महाराजक शासनकाल १२ जनवरी १७०८ सँ शुरू भेल आ १५ दिसम्बर १७४९ केँ समाप्त भेल ।,History
बहमनी सल्तनत के स्थापना के केलक ?,बहमनी सल्तनत के स्थापना आला-उद-दीन बहमान शाह द्वारा 1347 में भेल छल |,History
"केकरा कहलक, ""गड आला पान सिन्हा गेल""?","कहल जाइत अछि जे शिवाजी अपन गहींर आक्रोश ई कहि क' देखौलनि जे ""गड आला, पान सिन्हा गेल""- ""हमरा लोकनि किला जीतलहुँ, मुदा सिंह केँ हारलहुँ"" ई जानि जे किला तानाजी मालुसारेक बलिदान पर लेल गेल छल |",History
हेमादपंती मंदिर के बाहरी देवाल के की विशेषता छै?,हेमादपंती मंदिरक बाहरी देबाल प्रायः ताराक आकारक होइत अछि । तारा मंदिर निर्माण में मंदिर के बाहरी देवाल कई कोण में बंटल अछि | तेँ देबाल पर छायाक सुन्दर प्रभाव आ ओहि पर मूर्तिकला देख सकैत छी । हेमादपंती मंदिरक एकटा महत्वपूर्ण विशेषता ई अछि जे देबाल के पाथर बनेबा मे चूना के प्रयोग नहि कयल जाइत अछि | देबाल घुमाओल खांचे आ कस्प के आधार पर बनल अछि जे स्वयं पाथर मे कस क फिट बैसैत अछि ।,History
किताब-ए-नवरस' पोथी के लिखलनि ?,इब्राहिम आदिल शाह द्वितीय ‘किताब-ए-नवरस’ पुस्तक के लेखक थे |,History
