Question,Answer,Domain
साहित्य मे अविश्वसनीय कथाकारक की भूमिका होइत छैक ?,अविश्वसनीय कथाकार एहन कथाकार होइत छथि जिनकर कथा पर पूर्ण विश्वास नहि भ' सकैत अछि । कखनो काल अविश्वसनीय कथाकार सचेत रूपेँ पाठकसँ सूचना रोकि लैत छथि वा गुमराह करबाक प्रयास करैत छथि; आन बेर कोनो कथाकारक अविश्वसनीयता हुनका लोकनिक वश मे नहि रहैत छनि |,Literature
अन्तरपाठ्यता कोनो साहित्यिक कृति के कोना समृद्ध करैत अछि ?,"लेखक अंतरपाठ्यता के प्रयोग आलोचनात्मक या अतिरिक्त अर्थ पैदा करै लेली, कोनो बात कहै लेली, हास्य पैदा करै लेली, या यहाँ तक कि कोनो मौलिक रचना के पुनर्व्याख्या करै लेली भी करी सकै छै ।",Literature
"""पन्नी चरित्र"" शब्द के परिभाषित करू।","पन्नी पात्र एकटा साहित्यिक तत्व छै जे मुख्य पात्र, या नायक के विपरीत के काज करै छै.",Literature
त्रासदी आ हास्य मे की अंतर अछि ?,हास्य एकटा हास्य कथा अछि जकर अंत सुखद होइत अछि जखन कि त्रासदी एकटा गंभीर कथा अछि जकर अंत दुखद होइत अछि |,Literature
"नाटकीय साहित्य में ""कैथरिस"" की अवधारणा की व्याख्या कीजिए |",कैथरिस कला के माध्यम स मजबूत या दबल भावना के मुक्त करय के प्रक्रिया छै,Literature
कथ्य मे पूर्वाभास करबाक की उद्देश्य होइत छैक ?,"पूर्वाभास एकटा कथानक तत्व अछि जे कथा मे बाद मे किछु आबय बला बातक संकेत दैत अछि । लेखन में पूर्वाभास के प्रयोग करै के बहुत कारण छै, जेकरा में सस्पेंस के निर्माण, जिज्ञासा के चिंगारी पैदा करना, आरू अपनऽ पाठक के वू “अहा” क्षण के लेलऽ तैयार करना शामिल छै ।",Literature
कविता मे एकटा विशिष्ट प्रभाव उत्पन्न करबाक लेल अलंकार के कोना प्रयोग कयल जाइत अछि ?,"अलंकार एक ही ध्वनि केरऽ पुनरावृत्ति छै जे एक ही ध्वनि केरऽ पुनरावृत्ति होय छै जे एक ही ध्वनि केरऽ पुनरावृत्ति एक ही ध्वनि केरऽ एक श्रृंखला के शुरू होय छै जेकरऽ उद्देश्य एक श्रव्य नाड़ी प्रदान करना छै जे लेखन केरऽ टुकड़ा के लुलिंग, गीतात्मक, आरू/या भावनात्मक प्रभाव दै छै ।",Literature
सॉनेट के संरचना बताइए,अंग्रेजी सॉनेट प्रायः तीन चतुर्धातुक (4 पाँतिक छंद) आ ओकर बाद तुकबंदी वाला दोहा द्वारा बनैत अछि |,Literature
"""व्यक्तिकरण"" शब्द के परिभाषित करू।","व्यक्तिकरण के परिभाषित करलऽ गेलऽ छै कि “साहित्यिक या कलात्मक प्रभाव के रूप में वस्तु, अमूर्त विचार आदि के मानवीय विशेषता के आरोपण”, आरू “व्यक्ति, प्राणी आदि के रूप में कोनो अमूर्त गुण या विचार के प्रतिनिधित्व के रूप में, जैसऽ कि... कला आ साहित्य मे”",Literature
"""भारतीय अंग्रेजी साहित्य के जनक"" केकरा मानल जाइत अछि ?",मुल्क राज आनंद,Literature
वाल्मीकि द्वारा लिखित महाकाव्य का नाम बताइए।,रामायण,Literature
भारतीय साहित्य मे भक्ति आन्दोलन के की महत्व अछि ?,"सब विभिन्न हिन्दू देवता के एकता, भगवान के प्रति आत्म के समर्पण, सब लोक के समानता आ भाईचारा, आ जीवन के नंबर एक प्राथमिकता के रूप में भगवान के प्रति भक्ति पर जोर देलक |",Literature
किस भारतीय लेखक को साहित्य में नोबेल पुरस्कार प्राप्त किया?,रवीन्द्रनाथ टैगोर भारत आ एशिया सँ नोबेल पुरस्कार प्राप्त करय वाला पहिल व्यक्ति बनलाह ।,Literature
"रवीन्द्रनाथ टैगोर के ""गीतांजलि"" के केंद्रीय विषय की अछि ?",रहस्यवाद,Literature
"मराठी साहित्य मे ""बखर"" विधाक की महत्व अछि ?",मराठा शासक चत्रपति शिवाजी महाराज के कर्मों का वृत्तांत |,Literature
देशभक्ति एवं सामाजिक विषयों के लिये प्रसिद्ध मराठी कवि के नाम बताइए |,फकीर चंद भारती,Literature
कोन मराठी उपन्यास ब्रिटिश राज के सामाजिक आ राजनीतिक मुद्दा के खोज करैत अछि ?,राम धारी,Literature
"मराठी उपन्यास ""मणिनि"" के लेखक के छथि ?",एन एस फडके,Literature
"रवीन्द्रनाथ टैगोर केरऽ बंगाली उपन्यास ""गोरा"" केरऽ मुख्य विषय की छै ?","राष्ट्रवाद, पहचान, एवं सामाजिक सुधार।",Literature
"तमिल उपन्यास ""सिलप्पाधिकरण"" के लेखक कौन हैं ?",इलान्गो आदिगल,Literature
प्रकृति एवं अध्यात्म पर अपनी रचनाओं के लिए प्रसिद्ध मलयालम कवि के नाम बताइए |,सुगठाकुमारी,Literature
"हिन्दी साहित्य में ""प्रेमचंद युग"" का महत्व क्या है?","प्रेमचंद केरऽ रचना म॑ दलित, महिला, आरू किसान जैसनऽ हाशिया प॑ पड़लऽ समूहऽ के सामने आबै वाला संघर्ष आरू कठिनाई के चित्रण करलऽ गेलऽ छै, जेकरा म॑ राष्ट्रीय मुद्दा के समाधान लेली सामाजिक सौहार्द के जरूरत प॑ प्रकाश डाललऽ गेलऽ छै ।",Literature
"कन्नड़ उपन्यास ""वामसावृक्ष"" के लेखक कौन हैं ?",एस एल भिरप्पा,Literature
साहित्य मे भारतीय नव तरंग आन्दोलनक की महत्व अछि ?,"नव लहर सँ पहिने लोकप्रिय हिन्दी सिनेमा बेसी काल हिन्दी साहित्य केँ एकदम अनदेखी क' देने छल, एकर बदला मे उर्दू दिस मुड़ि गेल छल जे संकर, काव्य भाषा मे प्रेम, आस्था, आ न्यायक गप्प करैत छल. भारतीय नव लहर साहित्यिक हिन्दीक संस्कृत नवपद केँ पहिल बेर सिनेमाघर मे अनलक ।",Literature
"अरुंधती राय के उपन्यास ""छोट-छोट चीज के देवता"" के विषय की अछि ?","अरुंधती राय केरऽ द गॉड ऑफ स्मॉल थिंग्स भारत केरऽ दू भ्रातृ जुड़वाँ बच्चा के बारे म॑ छै जेकरऽ जीवन ओकरऽ अतीत केरऽ त्रासदी स॑ डिक्टेट होय जाय छै । महत्वपूर्ण विषय मे परिवार, निष्ठा, निषिद्ध प्रेम, उपनिवेशवाद/उत्तर औपनिवेशिकता, शिक्षा भेदभाव, आ सामाजिक वर्ग असमानता शामिल अछि |",Literature
भारत मे दलित साहित्य आन्दोलनक की महत्व अछि ?,दलित साहित्य भारतीय समाज के जाति आधारित ढाँचा के भीतर दलित समुदाय के मार्मिक सामाजिक आ राजनीतिक अनुभव के संप्रेषण के लेल एकटा सशक्त माध्यम के काज करैत अछि | ई दलित के जीवन क॑ आकार दै वाला असंख्य सामाजिक कारक आरू दलित आरू गैर-दलित दोनों समुदाय के साथ ओकरऽ बातचीत प॑ प्रकाश डालै छै ।,Literature
सकल घरेलू उत्पाद परिभाषित करब। एकर घटक आ सीमाक कें कल्याणकारी उपाय कें रूप मे बताउ.,"सकल घरेलू उत्पाद क मतलब अछि सकल घरेलू उत्पाद। इ कोनों देश कें सीमाक कें भीतर कोनों विशिष्ट अवधि कें भीतर उत्पादित सबटा वस्तुआक आ सेवाक कें कुल मूल्य कें माप छै, आमतौर पर सालाना या त्रैमासिक. कल्याण सं मतलब छै कोनों समाज कें भीतर व्यक्तियक कें समग्र कल्याण आ जीवन कें गुणवत्ता.",Economics
महंगाई के कारण की होइत अछि ? एकर प्रभाव आ नीतिगत प्रतिक्रिया पर चर्चा करू।,"अधिक नौकरी आ बेसि मजदूरी सं घरक कें आय बढ़य छै आ उपभोक्ता खर्च मे वृद्धि होयत छै, कुल मांग मे आ बेसि वृद्धि होयत छै आ फर्म कें लेल अपन वस्तु आ सेवाक कें दाम बढ़ावा कें गुंजाइश होयत छै. जखन ई पैघ संख्या मे व्यवसाय आ क्षेत्र मे होइत अछि त एहि स महंगाई बढ़ैत अछि।",Economics
"बेरोजगारी के परिभाषित करब। एकर प्रकार, कारण, आ नीतिगत समाधानक विश्लेषण करू।","बेरोजगारी तखन होयत छै जखन काज करय चाहय वाला मजदूर नौकरी नहि पाबि सकय छै. बेरोजगारी के उच्च दर आर्थिक संकट के संकेत दैत अछि जखन कि बेरोजगारी के अत्यंत कम दर बेसी गरम अर्थव्यवस्था के संकेत द सकैत अछि. बेरोजगारी कें घर्षण, चक्रीय, संरचनात्मक, या संस्थागत कें रूप मे वर्गीकृत कैल जा सकय छै.",Economics
भुगतान संतुलन बताइए। एकर घटक आ एकरा प्रभावित करय वाला कारक पर चर्चा करू.,"भुगतान संतुलन (बीओपी) ओ तरीका छै जइ सं देशक एकटा निश्चित अवधि कें भीतर सबटा अंतरराष्ट्रीय मौद्रिक लेनदेन कें मापयत छै. बीओपी मे तीन मुख्य खाता होयत छै: चालू खाता, पूंजी खाता, आ वित्तीय खाता.",Economics
राजकोषीय नीति की होइत अछि ? एकर औजार आ स्थिरीकरण मे प्रभावशीलता बताउ,"राजकोषीय नीति सार्वजनिक व्यय, कर आ सार्वजनिक ऋण कें संबंध मे सरकारी नीति कें संदर्भित करयत छै. ई वू साधन छै जेकरा स॑ सरकार अपनऽ खर्च के स्तर आरू कर दर क॑ समायोजित करी क॑ कोनो राष्ट्र केरऽ अर्थव्यवस्था प॑ नजर रखै आरू ओकरा प्रभावित करै छै ।",Economics
लोच परिभाषित करे। आर्थिक निर्णय मे एकर प्रकार आ महत्व बताउ।,लोच एकटा आर्थिक अवधारणा छै जेकरऽ उपयोग कोनों वस्तु या सेवा केरऽ मांग करलऽ जाय वाला कुल मात्रा म॑ बदलाव क॑ मापै लेली करलऽ जाय छै जे वू वस्तु या सेवा केरऽ मूल्यऽ के गति के संबंध म॑ होय छै । कोनों उत्पाद कें लोचदार मानल जायत छै अगर ओकर मूल्य बढ़ला या घटला पर उत्पाद कें मात्रा कें मांग आनुपातिक सं बेसि बदलय छै.,Economics
सही प्रतिस्पर्धा के बारे में बताइए। अल्पकालिक एवं दीर्घकालिक संतुलन का विश्लेषण करे |,अल्पावधि मे मांग स संतुलन प्रभावित होएत। दीर्घकाल मे कोनों उत्पाद कें मांग आ आपूर्ति दूनू सही प्रतिस्पर्धा मे संतुलन कें प्रभावित करतय. कोनों फर्म कें संतुलन बिंदु पर दीर्घकाल मे केवल सामान्य लाभ भेटतय.,Economics
"एकाधिकार परिभाषित करब। एकर विशेषता, मूल्य निर्धारण, आ सामाजिक लागत बताउ।","एकाधिकार एक प्रकार के बाजार संरचना छै, जेकरा म॑ एकल कंपनी आरू ओकरऽ वस्तु आरू सेवा हर समय बाजार प॑ हावी होय जाय छै । एकाधिकार बाजार केरऽ कुछ प्रमुख विशेषता म॑ एकल विक्रेता केरऽ उपस्थिति, प्रवेश म॑ अधिक बाधा, मूल्य म॑ अलोचना मांग, आरू विकल्प केरऽ कमी शामिल छै ।",Economics
अल्पसंख्यक के परिभाषित करू। एकर विशेषता आ मूल्य निर्धारण रणनीति बताउ।,"अल्पसंख्यक तखन होइत अछि जखन किछु कंपनी कोनो बाजार पर महत्वपूर्ण नियंत्रण रखैत अछि । ई कंपनी सब मिल क॑ एक-दूसरा स॑ मिलीभगत करी क॑ दाम प॑ नियंत्रण करी सकै छै, जेकरा स॑ अंततः बाजार म॑ अप्रतिस्पर्धी दाम उपलब्ध होय सकै छै ।",Economics
बाह्यता की होइत अछि ? सकारात्मक आ नकारात्मक बाह्यता आ ओकर निहितार्थ मे अंतर करू।,"आर्थिक लेनदेन कें अप्रत्यक्ष प्रभाव जे ओय लोगक कें प्रभावित करय छै जे लेनदेन मे प्रत्यक्ष रूप सं शामिल नहि छै. नकारात्मक बाह्यता तखन होइत अछि जखन कोनो लागत उझलि जाइत अछि । सकारात्मक बाह्यता तखन होइत अछि जखन कोनो लाभ उझलि जाइत अछि । अस्तु, बाह्यता तखन होइत अछि जखन कोनो लेनदेन कें किछु लागत या लाभ उत्पादक या उपभोक्ता कें अलावा ककरो पर पड़य छै.",Economics
कोन शहर के अपन ऑटोमोबाइल उद्योग के लेल “डेट्रायट ऑफ इंडिया” कहल जाइत अछि ?,चेन्नई केरऽ उपनाम “एशिया केरऽ डेट्रायट” (या “भारत केरऽ डेट्रायट”) छै । एकरऽ कारण छै कि शहर के आसपास प्रमुख ऑटोमोबाइल निर्माण इकाई आरू संबद्ध उद्योगऽ के मौजूदगी छै । अमेरिका में अधिकांश ऑटोमोबाइल निर्माण उद्योग अमेरिका के आसपास अछि |,Economics
एड वैलोरेम टैक्स कोन चीज कें लेल लागू कैल जायत छै?,वस्तु के दाम,Economics
लीड बैंक योजना कें अंतिम रूप देल गेलय एकटा कोन गहन विकास कें अपनावय कें लेल?,"गाम स्तर पर तत्परता अपनाबय लेल लीड बैंक योजना के अंतिम रूप देल गेल, जे किसान समुदाय के मदद करय के उद्देश्य सं छल.",Economics
कोन साल योजना आयोग के स्थापना भेल?,"भारत न॑ 1950 म॑ योजना आयोग केरऽ स्थापना करलकै, जेकरा म॑ संसाधन आवंटन, कार्यान्वयन आरू पांच साल केरऽ योजना केरऽ मूल्यांकन सहित योजना केरऽ पूरा श्रृंखला के देखरेख करलऽ गेलऽ छेलै । 5 साल के योजना के विचार सोवियत संघ स लेल गेल छल।",Economics
भारत मे सकल राज्य घरेलू उत्पाद(जीएसडीपी) कोन राज्य मे सबस बेसी अछि ?,राज्य आ यूटी मे सबस बेसी जीएसडीपी महाराष्ट्र मे अछि। वर्तमान दाम पर भारतक कुल सकल घरेलू उत्पाद मे एकर योगदान 14.11% अछि आ ओकर बाद तमिलनाडु (8.55%) अछि ।,Economics
स्कूल शिक्षा गुणवत्ता सूचकांक कोन संस्था शुरू केलक ?,नीती आयोग द्वारा स्कूली शिक्षा गुणवत्ता सूचकांक(SEQI) के शुभारंभ किया | सेक्यूआई मे सूचकक कें एकटा सेट शामिल छै जे स्कूली शिक्षा क्षेत्र कें समग्र प्रभावशीलता आ दक्षता कें महत्वपूर्ण रूप सं प्रभावित करएयत छै.,Economics
बैंक रेट की होइत अछि ?,बैंक रेट ओ दर अछि जाहि पर आरबीआई वाणिज्यिक बैंक कए उधार दैत अछि। बाजार मे मनी सप्लाई के प्रबंधन करय के औजार अछि. एखन एकर प्रयोग मे नहि अछि।,Economics
अल्पकालिक मे कोनों मैन्युफैक्चरिंग फर्म कें लेल निश्चित लागत की छै?,"अल्पकालिक बीमा प्रीमियम निश्चित लागत छै, कियाकि इ उत्पादन कें स्तर सं स्वतंत्र छै.",Economics
प्रधानमंत्री किसान सम्मान निधि (पीएम-किसान) योजना कें तहत सालाना देल जाय वाला कुल आय सहायता की छै?,"प्रधानमंत्री किसान सम्मान निधि (पीएम-किसान) योजना 2019 मे शुरू कैल गेल छल जे देश भर मे खेती योग्य जमीन वाला सब भूमिधारक किसान परिवार के आय सहायता प्रदान करय, किछु बहिष्कार के अधीन. योजना के तहत 1000 रुपया के राशि। 6000 प्रति वर्ष तीन किस्त मे 1000 रुपया जारी होइत अछि। 2000 प्रत्येक कें सीधा लाभार्थियक कें बैंक खाता मे डालल जायत छै.",Economics
