Question,Answer,Domain
1920 मे असहयोग आन्दोलन शुरू भेलाक संग केकर मृत्यु भेल?,"1 अगस्त 1920 के असहयोग आन्दोलन के घोषणा भेल, ओही दिन भोरे-भोर बाल गंगाधर तिलक के निधन के खबर आबि गेल |",Politics
किस भारतीय कार्यकर्ता के लोकप्रिय रूप से ‘लोखितवाड़ी’ के नाम से जाना जाता था?,"राव बहादुर गोपाल हरि देशमुख () लोखीतवाडी के नाम से भी जाना जाता है (18 फरवरी 1823 – 9 अक्टूबर 1892) महाराष्ट्र के एक भारतीय कार्यकर्ता, विचारक, समाज सुधारक एवं साहित्यकार थे |",Politics
भारत के पहिल राष्ट्रपति आ अमेरिका के पहिल राष्ट्रपति के छलाह ?,"राजेन्द्र प्रसाद एक भारतीय राजनीतिज्ञ, वकील, पत्रकार और विद्वान थे जो 1950 से 1962 तक भारत के प्रथम राष्ट्रपति के रूप में कार्यरत रहे।जॉर्ज वाशिंगटन (22 फरवरी, 1732 – 14 दिसम्बर, 1799) एक अमेरिकी संस्थापक, सैन्य अधिकारी, और राजनीतिज्ञ थे जो... १७८९ सँ १७९७ धरि अमेरिकाक पहिल राष्ट्रपतिक रूप मे काज केलनि ।",Politics
अब्दुल कलाम के छल? संक्षेप मे वर्णन करू।,"एपीजे अब्दुल कलाम (जन्म १५ अक्टूबर १९३१, रामेश्वरम, भारत-मृत्यु २७ जुलाई २०१५, शिलांग) एक भारतीय वैज्ञानिक आरू राजनीतिज्ञ छेलै जे भारत केरऽ मिसाइल आरू परमाणु हथियार कार्यक्रम के विकास म॑ प्रमुख भूमिका निभैलकै । 2002 सँ 2007 धरि भारतक राष्ट्रपति छलाह ।",Politics
मोदी के पहिल कार्यकाल में भारत के वित्त मंत्री के छलाह ?,अरुण जेटली (२८ दिसम्बर १९५२ – २४ अगस्त २०१९) एक भारतीय राजनीतिज्ञ आ वकील छल । भारतीय जनता पार्टी के सदस्य जेटली 2014 से 2019 तक भारत सरकार के वित्त एवं निगम मामलों के मंत्री के रूप में कार्यरत रहे |,Politics
नरेन्द्र मोदी की शैक्षणिक योग्यता क्या है ?,"1978 मे मोदी दिल्ली विश्वविद्यालय क स्कूल ऑफ ओपन लर्निंग स राजनीति विज्ञान मे बीए डिग्री प्राप्त केलथि, जाहि मे तेसर कक्षा स स्नातक केलथि। पांच साल बाद 1983 मे गुजरात विश्वविद्यालय स राजनीति विज्ञान मे मास्टर ऑफ आर्ट्स क डिग्री प्राप्त केलथि, बाहरी दूरस्थ शिक्षा क छात्र क रूप मे।",Politics
अयोध्या मे विवादित संरचना कहिया तोड़ल गेल? राज्य केहन छल। सरकार के सजा ?,6 दिसम्बर 1992 कए अयोध्या अर्थात बाबरी मस्जिद क विवादित संरचना कए तोड़ि देल गेल । उत्तर प्रदेश के भाजपा सरकार के खारिज क उत्तर प्रदेश के मुख्यमंत्री के खिलाफ कोर्ट के अवमानना के मामला मे सुप्रीम कोर्ट मे मामला दर्ज कायल गेल।,Politics
संविधान के कौन सा अनुच्छेद भारत के राष्ट्रपति के चुनाव के बारे में बताते हैं |,"भारत के संविधान के अनुच्छेद 54 के अनुसार राष्ट्रपति के चुनाव एकटा चुनावी महाविद्यालय द्वारा कयल जाइत अछि, जाहि में संसद के दुनु सदन के निर्वाचित सदस्य आ सब राज्य के विधान सभा के निर्वाचित सदस्य आ दिल्ली के एनसीटी के सेहो आ... पुडुचेरी के केंद्र शासित प्रदेश।",Politics
महाराष्ट्र मे लोकसभा सीट के संख्या कतेक अछि ?,"48 लोकसभा सीट वाला महाराष्ट्र उत्तर प्रदेश के बाद दोसर स्थान पर अछि, जाहि मे 80 सीट अछि.",Politics
संविधान के प्रारूपण समिति के समक्ष प्रस्तावना के प्रस्ताव देलक,"प्रस्तावना “उद्देश्य संकल्प” पर आधारित अछि, नेहरू के | जवाहरलाल नेहरू एकटा वस्तुनिष्ठ संकल्प प्रस्तावित केलनि आ तखने डॉ. बी.आर.अम्बेडकर संविधानक पाठ आ प्रस्तावना के डिजाइन केलनि।",Politics
1973 मे भारतक मुख्य न्यायाधीश के नियुक्ति भेल छल ? ई नियुक्ति विवादित किएक भ गेल?,"1973 मे सरकार तीनटा जज क वरिष्ठता कए एक कात राखि जस्टिस ए एन रे कए भारत क मुख्य न्यायाधीश नियुक्त केलक। ई नियुक्ति राजनीतिक रूप स॑ विवादित होय गेलै, कैन्हेंकि जे तीनों न्यायाधीश क॑ बदली देलऽ गेलै, वू सरकार केरऽ रुख के खिलाफ फैसला देल॑ छेलै ।",Politics
मार्च 1977 के आम चुनाव में जनता पार्टी आ ओकर सहयोगी दल के लोकसभा के कतेक सीट जीतल छल?,जनता पार्टी आ ओकर सहयोगी दल लोकसभा मे 542 सीट मे सं 330 सीट पर जीत हासिल केलक; जनता पार्टी स्वयं 295 सीट पर जीत हासिल केलक आ एहि तरहे ओकरा स्पष्ट बहुमत भेटल।,Politics
2024 तक महाराष्ट्र के मुख्यमंत्री के छथि ?,"एकनाथ संभाजी शिंदे एक भारतीय राजनीतिज्ञ छै जे ३० जून २०२२ स॑ महाराष्ट्र केरऽ २०वाँ आरू वर्तमान मुख्यमंत्री के रूप म॑ काम करी रहलऽ छै ।फरवरी २०२३ स॑ शिवसेना केरऽ नेता आरू जुलाई २०२२ स॑ सदन, महाराष्ट्र विधान सभा के नेता के रूप म॑ भी काम करी रहलऽ छै .",Politics
कोन हाईकोर्ट 12 जून 1975 कए प्रधानमंत्री इंदिरा गांधी क खिलाफ फैसला देलक आ ओ लोकसभा 1971 क सदस्यता गंवा देलक।,"उत्तर प्रदेश राज्य बनाम राज नारायण (1975 एआईआर 865, 1975 एससीआर (3) 333) इलाहाबाद हाईकोर्ट द्वारा सुनवाई 1975 मे भेल एकटा मामला छल जाहि मे भारत क प्रधानमंत्री इंदिरा गांधी कए चुनावी कदाचार क दोषी ठहराउल गेल छल ।",Politics
भारत में रियासत के एकीकरण में सरदार पटेल की भूमिका बताइए |,"सरदार पटेल आजादी के तुरंत बाद के महत्वपूर्ण अवधि में भारत के उप पीएम आरू गृहमंत्री छेलै । रियासत केरऽ शासकऽ स॑ दृढ़ता स॑ लेकिन कूटनीतिक रूप स॑ बातचीत करी क॑ अधिकांश क॑ भारतीय संघ म॑ लानै म॑ ऐतिहासिक भूमिका निभैलकै । भारत में रियासत के एकीकरण में सरदार पटेल ने निम्नलिखित भूमिका निभैलकै : कूटनीति आरू वार्ता के माध्यम स॑ रियासतऽ स॑ सदस्यता पत्र खरीदलकै । ओ हैदराबाद, जूनागढ़, मणिपुर आ कश्मीर राज्यक विलय लेल बल आ मनाबय के प्रयोग केलनि ।",Politics
1952 के पहिल आम चुनाव में कांग्रेस पार्टी आ भारतीय जनसंघ के चुनावी प्रतीक की छल ?,1952 के पहिल आम चुनाव में कांग्रेस पार्टी के प्रतीक बैल के जोड़ी आ दीपक (दीपक) भारतीय जनसंघ के प्रतीक छल |,Politics
शिवसेनाक मुख्यालय कतय अछि ?,शिवसेना के मुख्यालय आ मुख्य कार्यालय ठाणे में आनंद दीघे के घर पर अछि | दीघे शिवसेना मुखी नेता (मुख्य नेता) एकनाथ शिंदे के गुरु एवं गुरु रहे | २४ फरवरी २०२३ क॑ शिंदे न॑ उद्धव ठाकरे स॑ पार्टी क॑ संभालला के बाद मुख्यालय क॑ शिवसेना भवन स॑ स्थानांतरित करी देलऽ गेलै;[75] जबकि ठाकरे केरऽ गुट न॑ शिवसेना भवन प॑ नियंत्रण बरकरार रखलकै ।,Politics
एकमात्र भारतीय राज्य कोन राज्य छल जकर अपन आधिकारिक झंडा छल ?,"जम्मू-कश्मीर केरऽ राज्य ध्वज भारत केरऽ संविधान केरऽ अनुच्छेद ३७० द्वारा क्षेत्र क॑ देलऽ गेलऽ विशेष दर्जा के तहत, १९५२ स॑ २०१९ के बीच पूर्व भारतीय राज्य जम्मू-कश्मीर म॑ प्रयोग करलऽ जाय वाला प्रतीक छेलै । ई लाल-सफेद झंडा छल जाहि पर हल आ राज्यक तीन घटक क्षेत्रक प्रतिनिधित्व छल | अगस्त २०१९ मे अनुच्छेद ३७० समाप्त भेलाक बाद ई झंडा अपन आधिकारिक दर्जा गमा लेलक ।",Politics
पंजाब पर हावी तीन राजनीतिक दल के सूची बनाउ ?,"पुनर्गठित वर्तमान पंजाब में राजनीति में मुख्य रूप स तीन दल – भारतीय राष्ट्रीय कांग्रेस, आम आदमी पार्टी आ शिरोमणि अकाली दल (बदल) के बोलबाला अछि |",Politics
2024 तक यूपी के स्वास्थ्य मंत्री के छथि ?,"जय प्रताप सिंह (जन्म ७ सितम्बर १९५३) उत्तर प्रदेश सरकार के योगी आदित्यनाथ मंत्रालय में चिकित्सा एवं स्वास्थ्य, परिवार कल्याण, माँ एवं बाल कल्याण मंत्री के रूप में कार्यरत एक भारतीय राजनीतिज्ञ हैं |",Politics
2024 तक एमपी मे एखन कोन सरकार सत्ता मे अछि ?,"डॉ. मोहन यादव (जन्म २५ मार्च १९६५) एक भारतीय राजनीतिज्ञ आरू व्यापारी छै जे २०२३ (२०२४ के अनुसार) स॑ मध्य प्रदेश केरऽ १९वां आरू वर्तमान मुख्यमंत्री के रूप म॑ काम करी रहलऽ छै । भारतीय जनता पार्टी के सदस्य, 2013 से मध्य प्रदेश के विधान सभा के सदस्य के रूप में उज्जैन दक्षिण क्षेत्र का प्रतिनिधित्व कर रहे हैं |",Politics
2007 मे यूपी विधानसभा चुनाव के पोल परिणाम की छल?,बहुजन समाज पार्टी विधानसभा मे पूर्ण बहुमत हासिल कए 403 मे स 206 सीट जीत लेलक।,Politics
एम. करुनानिधि सबसँ पहिने किस क्षेत्र सँ तमिलनाडु विधानसभा मे चुनल गेलाह ?,कुलिथलाई,Politics
जेकरा दक्षिण भारत के पहिल कम्युनिस्ट मानल जाइत अछि |,मलयपुरम सिंगारावेलू दक्षिण भारतक पहिल साम्यवादी मानल जाइत अछि । 1925 मे ओ भारतीय कम्युनिस्ट पार्टीक संस्थापक मे सँ एक बनलाह; आरू कानपुर म॑ एकरऽ उद्घाटन अधिवेशन के अध्यक्षता करलकै । भारत में पहिल ट्रेड यूनियन के आयोजन के लेल सेहो जानल जाइत छथि आ 19वीं सदी के भारत में प्रचलित गंभीर अछूतता के प्रचलन के खिलाफ लड़लनि।,Politics
आंध्र प्रदेश के सबस प्रभावशाली राजनीतिक दल के संस्थापक के छलाह ?,तेलुगु देशम पार्टी (TDP; transl. Party of the Telugu Land) एक भारतीय क्षेत्रीय राजनीतिक दल छी जेकर प्रभाव आंध्र प्रदेश आ तेलंगाना राज्यमे अछि । एकरऽ स्थापना तेलुगु सिनेमा स्टार एनटी रामा राव (एनटीआर) न॑ २९ मार्च १९८२ क॑ करलकै आरू ई तेलुगु लोगऽ क॑ सहयोग करै प॑ केंद्रित छै ।,Politics
कर्नाटक के राजनीति में जे जाति समूह हावी अछि ओकर उल्लेख करू ?,कर्नाटक के राजनीतिक माहौल में दू जाति समूह के बोलबाला छै — दक्षिणी कर्नाटक में वोक्कलिगा के बोलबाला आरू उत्तर आरू मध्य कर्नाटक में लिंगायत के बोलबाला लेकिन दलित प्रमुख मतदाता छै आरू कर्नाटक में सत्ताधारी दल के निर्णायक कारक छै,Politics
भारत के कोन राज्य कम्युनिस्ट के सत्ता में चुनलक ?,"केरल न॑ १९५७ म॑ लोकतांत्रिक तरीका स॑ कम्युनिस्ट क॑ सत्ता म॑ चुनी क॑ इतिहास के निर्माण करलकै, जेकरा म॑ दुनिया म॑ पहलऽ ऐसनऽ करलकै ।",Politics
प्रशासनिक काज लेल बिहार मे कतेक डिवीजन अछि ?,"प्रशासनिक प्रयोजनक लेल बिहार राज्यक नौ प्रभाग अछि- पटना, तिरहुत, सारण, दरभंगा, कोसी, पूर्णिया, भागलपुर, मुंगेर, आ मगध प्रमंडल- जे दुनूक बीच अड़तीस जिला मे उपविभाजित अछि ।",Politics
पश्चिम बंगाल में शरणार्थी के आवागमन की भेल ?,"१९७१ केरऽ बांग्लादेश मुक्ति युद्ध के परिणामस्वरूप पश्चिम बंगाल म॑ लाखों शरणार्थी केरऽ आवागमन होय गेलै, जेकरा स॑ ओकरऽ बुनियादी ढाँचा प॑ काफी तनाव पैदा होय गेलै । शरणार्थी संकट क॑ काफी अच्छा तरीका स॑ निपटै के श्रेय सरकार क॑ अंतरराष्ट्रीय मीडिया न॑ देलकै ।",Politics
पश्चिम बंगाल मे 2024 तक कौन सी राजनीतिक दल प्रमुख अछि ?,अखिल भारतीय तृणमूल कांग्रेस पश्चिम बंगाल मे वर्तमान मे वर्तमान राजनीतिक दल अछि । 2011 के पश्चिम बंगाल विधान सभा के चुनाव में वाम मोर्चा अखिल भारतीय तृणमूल कांग्रेस स हार गेल छल जेकरा सीट के पूर्ण बहुमत भेटल छल। एहि स पश्चिम बंगाल मे 34 साल क कम्युनिस्ट शासन क अंत भ गेल आ संगहि दुनिया क सबस लंबा समय तक लोकतांत्रिक तरीका स चुनल गेल कम्युनिस्ट सरकार क अंत भ गेल। तृणमूल कांग्रेस के नेता ममता बनर्जी मुख्यमंत्री बनलीह.,Politics
उड़ीसा मे प्रांतीय विधान सभा के चुनाव के प्रावधान कोन अधिनियम छल ?,"भारत सरकार अधिनियम 1935 मे प्रांतीय विधान सभा आ सरकारक चुनावक प्रावधान छल, आ सरकारक प्रमुख केँ प्रधानमंत्रीक रूप मे नामित कयल गेल छल |",Politics
गुजरात के पहिल महिला मुख्यमंत्री के छलीह ?,आनंदीबेन मफतभाई पटेल (जन्म २१ नवम्बर १९४१) गुजरात केरऽ पहिलऽ आरू एकमात्र (२०२४ के अनुसार) महिला मुख्यमंत्री के रूप म॑ काम करलकै ।,Politics
2022 के गुजरात विधान सभा के चुनाव में कोन पार्टी सुपर बहुमत जीतने छल?,"2022 के गुजरात विधान सभा के चुनाव में भारतीय जनता पार्टी के 156 सीट के सुपर बहुमत मिलल छल जे गुजरात के इतिहास में कोनो पार्टी के सबस बेसी जीत छल. भारतीय राष्ट्रीय कांग्रेस 3 दशक तक राज्य मे अपन सबस कम गिनती मे गिर गेल, आ आम आदमी पार्टी कए पांच सीट भेटल।",Politics
2012 के गोवा चुनाव मे भारतीय राष्ट्रीय कांग्रेस के कोन पार्टी हरा देलक?,2012 के चुनाव मे भारतीय जनता पार्टी गोवा मे सीएम दिगंबर कामत के नेतृत्व मे भारतीय राष्ट्रीय कांग्रेस सरकार के हरा देलक। एहि चुनाव मे भाजपा-महाराष्ट्रवादी गोमंतक गठबंधन जीत लेलक जे 40 सीट वाला विधानसभा मे 24 सीट पर जीत हासिल केलक।,Politics
गुजरात मे कुल कतेक क्षेत्र अछि ?,182,Politics
महाराष्ट्र नवनिर्माण सेना के गठन केने छल ?,महाराष्ट्र नवनिर्माण सेना (अनुवाद: महाराष्ट्र सुधार सेना; abbr. MNS) महाराष्ट्र राज्य में स्थित एक क्षेत्रवादी सुदूर दक्षिणपंथी भारतीय राजनीतिक दल छै आरू हिन्दुत्व आरू मराठी मनु के विचारधारा पर संचालित छै ।[12][13] एकर स्थापना 9 मार्च 2006 कए मुंबई मे राज ठाकरे अपन चचेरा भाई उद्धव ठाकरे स मतभेद क कारण शिवसेना पार्टी छोड़लाक बाद केलथि,Politics
