Question,Answer,Domain
१९२० तमे वर्षे असहयोग-आन्दोलनस्य आरम्भे कस्य मृत्युः अभवत् ?,"१९२० तमे वर्षे अगस्तमासस्य १ दिनाङ्के असहयोग-आन्दोलनस्य घोषणा अभवत्, तस्मिन् एव दिने प्रातःकाले बालगंगाधरतिलकस्य मृत्योः वार्ता आगता ।",Politics
लोखितवाडी' इति नाम्ना कः भारतीयः कार्यकर्ता लोकप्रियतया प्रसिद्धः आसीत् ?,"रावबहादुरगोपाल हरिदेशमुख () लोखीतवाडी नाम्ना अपि प्रसिद्धः (१८ फरवरी १८२३ – ९ अक्टोबर १८९२) महाराष्ट्रस्य एकः भारतीयः कार्यकर्ता, विचारकः, समाजसुधारकर्ता, लेखकः च आसीत् ।",Politics
भारतस्य प्रथमः राष्ट्रपतिः अमेरिकादेशस्य प्रथमः राष्ट्रपतिः च कः आसीत् ?,"राजेन्द्रप्रसादः भारतीयराजनेता, वकीलः, पत्रकारः, विद्वान् च आसीत् यः १९५० तः १९६२ पर्यन्तं भारतस्य प्रथमराष्ट्रपतिरूपेण कार्यं कृतवान् ।जार्ज वाशिङ्गटनः (२२ फरवरी, १७३२ – १४ दिसम्बर् १७९९) अमेरिकनसंस्थापकः पिता, सैन्यपदाधिकारी, राजनेता च आसीत् यः... १७८९ तः १७९७ पर्यन्तं अमेरिकादेशस्य प्रथमराष्ट्रपतिरूपेण कार्यं कृतवान् ।",Politics
अब्दुल कलमः कः आसीत् ? संक्षेपेण वर्णयतु।,"एपीजे अब्दुल कलाम (जन्म १५ अक्टोबर् १९३१, रामेश्वरम्, भारत-मृत्युः २७ जुलै २०१५, शिलाङ्ग) एकः भारतीयः वैज्ञानिकः राजनेता च आसीत् यः भारतस्य क्षेपणास्त्र-परमाणुशस्त्र-कार्यक्रमस्य विकासे अग्रणी भूमिकां निर्वहति स्म । सः २००२ तः २००७ पर्यन्तं भारतस्य राष्ट्रपतिः आसीत् ।",Politics
मोदी इत्यस्य प्रथमकार्यकाले भारतस्य वित्तमन्त्री कः आसीत् ?,अरुण जेटली (२८ दिसम्बर १९५२ – २४ अगस्त २०१९) भारतीयराजनेता वकिलः च आसीत् । भारतीयजनतापक्षस्य सदस्यः जेटली २०१४ तः २०१९ पर्यन्तं भारतसर्वकारस्य वित्त-निगममन्त्रीरूपेण कार्यं कृतवान् ।,Politics
नरेन्द्र मोदी के शैक्षणिक योग्यता कानि सन्ति ?,"१९७८ तमे वर्षे मोदी दिल्लीविश्वविद्यालयस्य स्कूल् आफ् ओपन लर्निङ्ग् इत्यस्मात् राजनीतिशास्त्रे बीए उपाधिं प्राप्तवान्, तृतीयवर्गेण स्नातकः अभवत् । पञ्चवर्षेभ्यः अनन्तरं १९८३ तमे वर्षे गुजरातविश्वविद्यालयात् राजनीतिशास्त्रे स्नातकोत्तरपदवीं प्राप्तवान्, बाह्यदूरशिक्षणस्य छात्रत्वेन ।",Politics
अयोध्यायां विवादितसंरचना कदा ध्वस्तं जातम् ? राज्यं कथं आसीत्। सर्वकारः दण्डितः ?,१९९२ तमे वर्षे डिसेम्बर्-मासस्य ६ दिनाङ्के अयोध्या अर्थात् बाबरी-मस्जिदस्य विवादास्पदं संरचना ध्वस्तं जातम् । उत्तरप्रदेशस्य भाजपासर्वकारं निरस्तं कृत्वा उत्तरप्रदेशस्य मुख्यमन्त्रीविरुद्धं सर्वोच्चन्यायालये न्यायालयस्य अवमाननायाः प्रकरणं रजिस्ट्रेशनं कृतम्।,Politics
संविधानस्य कस्मिन् अनुच्छेदे भारतस्य राष्ट्रपतिनिर्वाचनस्य विषये वर्तते ?,"भारतस्य संविधानस्य अनुच्छेद ५४ अनुसारं राष्ट्रपतिः निर्वाचनमहाविद्यालयेन निर्वाचितः भवति, यस्मिन् संसदस्य द्वयोः सदनयोः निर्वाचितसदस्याः तथा च सर्वेषां राज्यानां विधानसभानां निर्वाचितसदस्याः अपि च दिल्लीयाः एनसीटी तथा च... पुडुचेरी के केन्द्रीय क्षेत्र।",Politics
महाराष्ट्रे लोकसभासीनानां संख्या कियती अस्ति ?,४८ लोकसभासीटैः सह महाराष्ट्रदेशः उत्तरप्रदेशस्य पश्चात् द्वितीयस्थाने अस्ति यत्र ८० आसनानि सन्ति ।,Politics
संविधानस्य प्रारूपणसमित्याः समक्षं केन प्रस्तावना प्रस्ताविता,"प्रस्तावना “उद्देश्यसंकल्प” इत्यस्य आधारेण अस्ति, नेहरू इत्यस्य । जवाहरलालनेहरू इत्यनेन वस्तुनिष्ठः संकल्पः प्रस्तावितः तदा एव डॉ. बी.आर.अम्बेडकरः संविधानस्य पाठस्य प्रस्तावनायाश्च परिकल्पनां कृतवान् ।",Politics
१९७३ तमे वर्षे भारतस्य मुख्यन्यायाधीशः कः नियुक्तः ? एषा नियुक्तिः किमर्थं विवादास्पदः अभवत् ?,१९७३ तमे वर्षे सर्वकारेण त्रयाणां न्यायाधीशानां वरिष्ठतां त्यक्त्वा न्यायाधीशः ए.एन.रे भारतस्य मुख्यन्यायाधीशरूपेण नियुक्तः । नियुक्तिः राजनैतिकरूपेण विवादास्पदः अभवत् यतोहि ये त्रयः अपि न्यायाधीशाः प्रतिस्थापिताः आसन् तेषां सर्वकारस्य स्थापनस्य विरुद्धं निर्णयाः दत्ताः आसन् ।,Politics
१९७७ तमस्य वर्षस्य मार्चमासस्य सामान्यनिर्वाचने जनतापक्षेण तस्य मित्रराष्ट्रैः च कति लोकसभासीटानि प्राप्तानि?,लोकसभायाः ५४२ आसनेषु ३३० आसनेषु जनतापक्षः तस्य मित्रपक्षः च प्राप्तवान्; जनतापक्षः एव २९५ आसनानि प्राप्तवान् तथा च स्पष्टबहुमतं प्राप्तवान् ।,Politics
२०२४ तमे वर्षे महाराष्ट्रस्य मुख्यमन्त्री कः ?,एकनाथसंभाजी शिण्डे एकः भारतीयः राजनेता अस्ति यः ३० जून २०२२ तः महाराष्ट्रस्य २०तमः वर्तमानः च मुख्यमन्त्रीरूपेण कार्यं कुर्वन् अस्ति ।सः २०२३ तमस्य वर्षस्य फरवरीतः शिवसेना-नेतृत्वेन अपि च २०२२ तमस्य वर्षस्य जुलै-मासात् महाराष्ट्रविधानसभायाः सदनस्य नेता इति कार्यं कुर्वन् अस्ति .,Politics
कः उच्चन्यायालयः प्रधानमन्त्रिणः इन्दिरागान्धीविरुद्धं १२ जून १९७५ दिनाङ्के निर्णयं दत्तवान् तथा च सा १९७१ तमे वर्षे लोकसभायाः सदस्यतां त्यक्तवती।,"उत्तरप्रदेशराज्य विरुद्धराजनारायण (१९७५ एआइआर ८६५, १९७५ एससीआर (३) ३३३) इलाहाबाद उच्चन्यायालयेन १९७५ तमे वर्षे श्रुतः प्रकरणः आसीत् यस्मिन् भारतस्य प्रधानमन्त्री इन्दिरागान्धी निर्वाचनकदाचारस्य दोषी इति निर्णीतः",Politics
भारते रियासतानां एकीकरणे सरदार पटेलस्य भूमिकां व्याख्यातव्यम्।,"स्वातन्त्र्यानन्तरं तत्क्षणमेव निर्णायककाले सरदारपटेलः भारतस्य उपप्रधानमन्त्री गृहमन्त्री च आसीत् । रियासतानां शासकैः सह दृढतया किन्तु कूटनीतिकरूपेण वार्तालापं कृत्वा तेषां अधिकांशं भारतीयसङ्घं प्रति आनयितुं ऐतिहासिकं भूमिकां निर्वहति स्म । भारते रियासतानां एकीकरणे सरदार पटेलः निम्नलिखितभूमिकां निर्वहति स्म : सः कूटनीति-वार्तालापद्वारा रियासतानां सदस्यतापत्रं क्रीतवान् सः हैदराबाद-जुनागढ-मणिपुर-काश्मीर-राज्यैः सह तेषां विलयार्थं बलस्य, अनुनयस्य च उपयोगं कृतवान् ।",Politics
१९५२ तमे वर्षे प्रथमसामान्यनिर्वाचने काङ्ग्रेसपक्षस्य भारतीयजनसंघस्य च निर्वाचनप्रतीकाः के आसन् ?,१९५२ तमे वर्षे प्रथमे सामान्यनिर्वाचने काङ्ग्रेसपक्षस्य प्रतीकं गोयुगलं दीपकं च (दीपकं) भारतीयजनसंघस्य प्रतीकम् आसीत् ।,Politics
शिवसेनायाः मुख्यालयाः कुत्र सन्ति ?,शिवसेनायाः मुख्यालयः मुख्यकार्यालयः च ठाणे-नगरे आनन्ददीघे इत्यस्य गृहे स्थितः अस्ति । दीघे शिवसेना मुखी नेटा (मुख्य नेता) एकनाथ शिंदे के गुरु व मार्गदर्शक थे। २०२३ तमस्य वर्षस्य फेब्रुवरी-मासस्य २४ दिनाङ्के शिंदेः उद्धवठाकरे इत्यस्मात् दलं स्वीकृत्य मुख्यालयं शिवसेनाभवनात् स्थानान्तरितम्;[७५] यदा तु ठाकरे-गुटेन शिवसेनाभवनस्य नियन्त्रणं स्थापितं,Politics
कस्य एकमात्रं भारतीयराज्यं यस्य स्वकीयः आधिकारिकध्वजः आसीत् ?,जम्मू-कश्मीरस्य राज्यध्वजः भारतस्य संविधानस्य अनुच्छेदः ३७० द्वारा अस्य क्षेत्रस्य विशेषपदवीं प्राप्य १९५२ तः २०१९ पर्यन्तं पूर्वभारतीयजम्मू-कश्मीरराज्ये प्रयुक्तः प्रतीकः आसीत् हलस्य प्रतिनिधित्वं कृत्वा राज्यस्य त्रयः घटकप्रदेशाः च रक्तशुक्लध्वजः आसीत् । २०१९ तमस्य वर्षस्य अगस्तमासे ३७० अनुच्छेदस्य उन्मूलनानन्तरं अस्य ध्वजस्य आधिकारिकं स्थानं नष्टम् अभवत् ।,Politics
पञ्जाबदेशे ये त्रयः राजनैतिकदलाः वर्चस्वं धारयन्ति तेषां सूचीं कुरुत ?,"पुनर्गठितवर्तमानपञ्जाबस्य राजनीतिषु मुख्यतया त्रयः दलाः – भारतीयराष्ट्रीयकाङ्ग्रेसः, आम आदमीपक्षः, शिरोमणि अकालीदलः (बदलः) च प्रधानतया वर्तते ।",Politics
२०२४ तमे वर्षे यूपी-देशस्य स्वास्थ्यमन्त्री कः ?,जयप्रतापसिंह (जन्म ७ सितम्बर १९५३) उत्तरप्रदेशसर्वकारस्य योगीआदित्यनाथमन्त्रालये चिकित्सास्वास्थ्यपरिवारकल्याणमातृबालकल्याणमन्त्रीरूपेण कार्यं कुर्वन् भारतीयराजनेता अस्ति ।,Politics
२०२४ तमे वर्षे मप्रदेशे सम्प्रति कः सर्वकारः सत्तायां वर्तते ?,"डॉ. मोहन यादव (जन्म २५ मार्च १९६५) एकः भारतीयराजनेता व्यापारी च अस्ति, यः २०२३ तः (२०२४ तमे वर्षे) मध्यप्रदेशस्य १९ तमे वर्तमानस्य च मुख्यमन्त्रीरूपेण कार्यं करोति । भारतीयजनतापक्षस्य सदस्यः सः २०१३ तः मध्यप्रदेशस्य विधानसभायाः सदस्यत्वेन उज्जैनदक्षिणक्षेत्रस्य प्रतिनिधित्वं करोति ।",Politics
२००७ तमे वर्षे यूपी-विधानसभानिर्वाचनस्य Poll-परिणामः किम् आसीत् ?,"बहुजनसमाजपक्षः विधानसभायां पूर्णबहुमतं प्राप्तवान्, ४०३ आसनेषु २०६ आसनानि प्राप्तवान् ।",Politics
एम. करुनिधिः प्रथमवारं कस्मात् निर्वाचनक्षेत्रात् तमिलनाडुविधानसभायां निर्वाचितः ?,कुलिथलै,Politics
यः दक्षिणभारतस्य प्रथमः साम्यवादी इति मन्यते,मलयपुरम् सिङ्गरावेलु दक्षिणभारतस्य प्रथमः साम्यवादी इति मन्यते । १९२५ तमे वर्षे सः भारतस्य साम्यवादीदलस्य संस्थापकपितृषु अन्यतमः अभवत्; तथा कानपुरनगरे तस्य उद्घाटनसम्मेलनस्य अध्यक्षतां कृतवान्। सः भारते प्रथमस्य श्रमिकसङ्घस्य आयोजनाय अपि प्रसिद्धः अस्ति तथा च १९ शताब्द्यां भारते प्रचलितस्य तीव्रस्य अस्पृश्यतायाः प्रसारस्य विरुद्धं युद्धं कृतवान् ।,Politics
आन्ध्रप्रदेशस्य प्रभावशालिनः राजनैतिकदलस्य संस्थापकः कः आसीत् ?,"तेलुगुदेशम पार्टी (TDP; transl. Party of the Telugu Land) आन्ध्रप्रदेश-तेलाङ्गाना-राज्ययोः प्रभावं विद्यमानः भारतीयः क्षेत्रीयराजनैतिकदलः अस्ति । अस्य स्थापना तेलुगुचलच्चित्रनटः एनटी रामाराव (एनटीआर) इत्यनेन १९८२ तमे वर्षे मार्चमासस्य २९ दिनाङ्के कृता, तेलुगुजनानाम् समर्थने केन्द्रितम् अस्ति ।",Politics
कर्णाटकस्य राजनीतिषु ये जातिसमूहाः आधिपत्यं कुर्वन्ति तेषां उल्लेखं कुरुत ?,कर्नाटकस्य राजनैतिकवातावरणे द्वयोः जातिसमूहयोः प्रधानता वर्तते — दक्षिणकर्नाटकदेशे वोक्कलिगानां प्रधानता तथा उत्तरमध्यकर्नाटकदेशे लिंगायतानां प्रधानता किन्तु दलिताः प्रमुखमतदातारः कर्नाटकस्य सत्ताधारीपक्षस्य निर्णायककारकाः च सन्ति,Politics
भारते कस्मिन् राज्ये साम्यवादिनः सत्तां निर्वाचिताः ?,"केरलेन १९५७ तमे वर्षे लोकतान्त्रिकरूपेण साम्यवादिनः सत्तायाः निर्वाचनं कृत्वा इतिहासस्य निर्माणं कृतम्, विश्वे प्रथमः देशः अभवत् ।",Politics
प्रशासनिकप्रयोजनार्थं बिहारस्य कति विभागाः सन्ति ?,"प्रशासनिकप्रयोजनार्थं बिहारराज्यस्य नव विभागाः सन्ति-पटना, तिरहुत, सारण, दरभंगा, कोसी, पूर्णिया, भागलपुर, मुंगेर, मगधप्रभागः च येषां मध्ये अष्टत्रिंशत् जिल्हेषु उपविभक्ताः सन्ति",Politics
पश्चिमबङ्गदेशे शरणार्थीनां प्रवाहः किं जातम् ?,"१९७१ तमे वर्षे बाङ्गलादेशस्य मुक्तियुद्धस्य परिणामेण पश्चिमबङ्गदेशं प्रति कोटिकोटिशरणार्थीनां प्रवाहः अभवत्, येन तस्य आधारभूतसंरचनायाः उपरि महत्त्वपूर्णः तनावः उत्पन्नः । अन्तर्राष्ट्रीयमाध्यमेन शरणार्थीसंकटं सम्यक् सम्पादयितुं सर्वकारस्य श्रेयः दत्तः ।",Politics
२०२४ तमे वर्षे पश्चिमबङ्गदेशे कः प्रधानः राजनैतिकदलः अस्ति ?,अखिलभारतीय तृणमूलकाङ्ग्रेसः पश्चिमबङ्गदेशे सम्प्रति वर्तमानः राजनैतिकदलः अस्ति । २०११ तमे वर्षे पश्चिमबङ्गविधानसभानिर्वाचने वाममोर्चा अखिलभारतीयतृणमूलकाङ्ग्रेसपक्षेण पराजितः अभवत् यया आसनानां पूर्णबहुमतं प्राप्तम् । अनेन पश्चिमबङ्गदेशे ३४ वर्षीयस्य साम्यवादीशासनस्य समाप्तिः अभवत् तथा च विश्वस्य दीर्घकालं यावत् लोकतान्त्रिकरूपेण निर्वाचितस्य साम्यवादीसर्वकारस्य समाप्तिः अभवत् । तृणमूलकाङ्ग्रेसस्य नेता ममता बनर्जी मुख्यमन्त्री अभवत् ।,Politics
उड़ीसादेशे प्रान्तीयविधानसभायाः निर्वाचनस्य व्यवस्था कस्मिन् अधिनियमे कृता?,"१९३५ तमे वर्षे भारतसर्वकारस्य अधिनियमेन प्रान्तीयविधानसभायाः, सर्वकारस्य च निर्वाचनस्य व्यवस्था आसीत्, सर्वकारस्य प्रमुखः प्रधानमन्त्रीरूपेण निर्दिष्टः च ।",Politics
गुजरातस्य प्रथमा महिला मुख्यमन्त्री का आसीत् ?,आनन्दिबेन् मफतभाई पटेल (जन्म २१ नवम्बर १९४१) गुजरातस्य प्रथमा एकमात्रं च (२०२४ तमे वर्षे) महिलामुख्यमन्त्रीरूपेण कार्यं कृतवती ।,Politics
