Question,Answer,Domain
२०२२ तमे वर्षे गुजरातविधानसभानिर्वाचने कस्य दलस्य सुपर बहुमतं प्राप्तम्?,"२०२२ तमे वर्षे गुजरातविधानसभानिर्वाचने भारतीयजनतापक्षः १५६ सीटानां सुपर बहुमतं प्राप्तवान्, यत् गुजरातस्य इतिहासे कस्यापि दलस्य सर्वाधिकं विजयं प्राप्तवान् भारतीयराष्ट्रीयकाङ्ग्रेसपक्षः ३ दशकपर्यन्तं राज्ये न्यूनतमगणनायां पतितः, आम आदमीपक्षः च पञ्च आसनानि प्राप्तवान् ।",Politics
२०१२ तमे वर्षे गोवानिर्वाचने भारतीयराष्ट्रीयकाङ्ग्रेसपक्षं कः दलः पराजितवान्?,२०१२ तमे वर्षे निर्वाचने भारतीयजनतापक्षः गोवानगरे सीएम दिगम्बर कामतस्य नेतृत्वे भारतीयराष्ट्रीयकाङ्ग्रेससर्वकारं पराजितवान् । निर्वाचने भाजपा-महाराष्ट्रवादी गोमन्तकगठबन्धनेन विजयः प्राप्तः यः ४० सीटयुक्ते विधानसभायां २४ आसनानि प्राप्तवान् ।,Politics
गुजरातदेशे कुलम् कति निर्वाचनक्षेत्राणि सन्ति ?,182,Politics
महाराष्ट्र नवनिर्मण सेना केन निर्मितम्?,"महाराष्ट्र नवनिर्माणसेना (अनुवादः महाराष्ट्रसुधारसेना; abbr. MNS) महाराष्ट्रराज्ये स्थितः क्षेत्रवादी सुदूरदक्षिणपक्षीयः भारतीयराजनैतिकदलः अस्ति, यः हिन्दुत्वस्य मराठीमनुषां च विचारधारायां कार्यं करोति ।[१२][१३] अस्य स्थापना ९ मार्च २००६ तमे वर्षे मुम्बईनगरे राज ठाकरे इत्यनेन सह स्वमातुलपुत्रेण उद्धवठाकरे इत्यनेन सह मतभेदात् शिवसेनापक्षं त्यक्त्वा अभवत्",Politics
सामाजिक-इतिहासकारः बद्रीनारायणेन चिह्नितः २०१५ तमे वर्षे बिहारनिर्वाचने प्रमुखः कारकः कः आसीत् ?,"हिन्दुत्वराजनीतिः जातिराजनीतेः सामना कर्तुं आसीत् यथा सामाजिक-इतिहासकारः बद्रीनारायणः अवदत्, यः २०१५ तमस्य वर्षस्य राजनैतिक-अशान्तिं अनेकेषां क्षेत्रीयराजनैतिकदलानां, नेतारणाञ्च समक्षं स्थापितायाः आव्हानस्य भागत्वेन चिह्नितवान्, येषां सर्वेषां अन्तः विशिष्टजातीयसमूहानां समर्थनं प्राप्यते स्म तेषां अवस्थाः ।",Politics
भारतीयराष्ट्रीयविकाससमावेशीगठबन्धनस्य (INDIA) निर्माणस्य पृष्ठतः किं प्रेरणा आसीत् ?,२०१४ तमे वर्षे २०१९ तमे वर्षे च सामान्यनिर्वाचने विपक्षस्य एनडीए-पक्षं पराजयितुं असमर्थतायाः अनन्तरं २०२४ तमे वर्षे सामान्यनिर्वाचने भाजपा-नेतृत्वेन एनडीए-विरुद्धं स्थातुं प्रायः सर्वेषां प्रमुखराजनैतिकदलानां भव्यगठबन्धनस्य आवश्यकता एव प्रेरणा आसीत्,Politics
फ्रीडम हाउस् इत्यनेन २०२३ तमे वर्षे भारतीयप्रजातन्त्रस्य स्थितिः कथं वर्गीकृता?,"२०२३ तमे वर्षे फ्रीडम हाउस् इत्यस्य फ्रीडम् इन द वर्ल्ड इति प्रतिवेदने भारतं तृतीयवर्षं यावत् ""अंशतः स्वतन्त्रम्"" इति वर्गीकृतम् ।",Politics
निर्वाचनआयोगः केन कानूनानुसारं कार्यं करोति ?,निर्वाचनआयोगः संविधानस्य अनुच्छेदः ३२४ तदनन्तरं जनप्रतिनिधित्वकानूनेन च प्रदत्तानां अधिकारानां अन्तर्गतं कार्यं करोति ।,Politics
भारतस्य ब्राजीलस्य च जलवायुस्य तुलनां कुर्वन्तु,"1. भारते मानसूनप्रकारस्य जलवायुः अस्ति यदा तु ब्राजील्-देशः जलवायुस्य विस्तृतविविधतां अनुभवति । उदाहरणार्थं ब्राजीलदेशे विषुववृत्तस्य समीपे जलवायुः उष्णः भवति यदा मकरराशिस्य उष्णकटिबंधस्य समीपे समशीतोष्णप्रकारस्य जलवायुः अस्ति । 2. भारते वर्षभरि औसततापमानं अधिकं भवति यतः सूर्यस्य किरणाः कर्करोगस्य उष्णकटिबंधपर्यन्तं लम्बवत् भवन्ति यत् तस्मात् गच्छति यदा तु ब्राजील्देशे विषुववृत्तं देशस्य उत्तरभागं कटयति यस्य परिणामेण 25"" C तः 28 पर्यन्तं भवति ° अमेजन उपत्यकायां औसततापमानस्य C भारतस्य दक्षिणराज्यं प्रति तस्य विपरीतम् ब्राजीलस्य उत्तरभागः सामान्यतया उष्णः भवति यदा दक्षिणभागे तापमानं तुल्यकालिकरूपेण न्यूनं भवति 4. भारते दक्षिणपश्चिममानसूनवायुना वर्षा भवति तथा च वर्षा मुख्यतया ओरोग्राफिकस्य भवति type whereas Brazil receives the orographic type of rainfall from the South-east Trade winds & North-east Trade winds and ब्राजीलस्य उत्तरभागे वर्षा संवहनप्रकारस्य भवति 5. भारते गुजरात-राजस्थानयोः क्षेत्रेषु न्यूनवृष्टिः भवति यदा तु ब्राजीलस्य उच्चभूमिस्य ईशानभागे अत्यल्पवृष्टिः भवति । 6. भारते उष्णकटिबंधीयचक्रवाताः बहुधा भवन्ति यदा तु ब्राजील्देशे एते चक्रवाताः दुर्लभाः भवन्ति ।",Geography
नर्मदा उपत्यकायां सान्द्रवस्तयः दृश्यन्ते यतः...,"नदीसमीपे कृषियोग्यभूमित्वात् नर्मदाउपत्यकायां सान्द्रवस्तयः दृश्यन्ते । नर्मदा उपत्यका मुख्यतया गुजरात-मध्यप्रदेशयोः स्थिता अस्ति, नदीसमीपे भूमिः अतीव कृषियोग्या अस्ति ।",Geography
कृषकाणां हिताय सर्वकारेण प्रवर्तितानां विविधानां संस्थागतसुधारकार्यक्रमानाम् प्रवेशं कुर्वन्तु।,"अन्ये कारकाः ये बस्तीनां स्वरूपं प्रभावितं कर्तुं शक्नुवन्ति ते सन्ति : जलस्य उपलब्धता, भूमिस्य सानुः, जलवायुप्रकारः च ।",Geography
तण्डुलानां वृद्ध्यर्थं आवश्यकाः भौगोलिकाः परिस्थितयः वर्णयतु ।,भारते प्रायः नर्मदा उपत्यकायाः पठारप्रदेशे नाभिकयुक्ताः बस्तयः दृश्यन्ते ।,Geography
भारतं विश्वे ............. इत्यस्य प्रमुखः उत्पादकः निर्यातकः च अस्ति ।,चाय,Geography
पीतक्रान्तिः इति निर्दिशति,तैलबीजानां उत्पादनं वर्धितम् ।,Geography
विश्वे तण्डुलस्य उत्पादनस्य दृष्ट्या भारतस्य स्थानं कस्मिन् स्थाने अस्ति ?,क्षण,Geography
भारते अङ्गारस्य वितरणं वर्णयतु।,"भारते अङ्गारः मुख्यभूवैज्ञानिकयुगद्वयस्य शिलाश्रृङ्खलायां भवति, यथा गोण्डवाना, २० कोटिवर्षेभ्यः किञ्चित् अधिकं आयुः भवति तथा च तृतीयकनिक्षेपेषु भवति ये केवलं प्रायः ५५ मिलियनवर्षपुराणाः सन्ति गोण्डवाना-अङ्गारस्य प्रमुखाः संसाधनाः, ये धातुविज्ञान-अङ्गाराः सन्ति, ते दामोदर-उपत्यकायां (पश्चिमबङ्ग-झारखण्ड) स्थिताः सन्ति । झरिया, रानीगंज, बोकारो इत्यादीनि महत्त्वपूर्णानि अङ्गारक्षेत्राणि सन्ति । गोदावरी, महानदी, सोन, वर्धा उपत्यकासु अपि अङ्गारनिक्षेपाः सन्ति । मेघालय, असम, अरुणाचलप्रदेश, नागालैण्ड् इत्यादिषु ईशानराज्येषु तृतीयाङ्गारः भवति । झारखण्डः सर्वाधिकं उत्पादकः अस्ति यत्र झरिया, बोकारो, करम्पुर , पलामू प्रमुखाः अङ्गारक्षेत्राणि सन्ति । पश्चिमबङ्गदेशे रानीगञ्जः, जलपैगुरी, दार्जिलिंग् च अङ्गारक्षेत्राणि सन्ति । सरगुजा, बिलासपुर, रायगढ, बस्तार मण्डलानि छत्तीसगढे दृश्यन्ते अङ्गारक्षेत्राणि । एमपी इत्यस्य चाइनावेयर-मण्डले अङ्गारक्षेत्राणि सन्ति, महाराष्ट्रे च चण्डा-नगरं मुख्यक्षेत्रम् अस्ति ।",Geography
झारखण्ड की कोडरमा गया-हजरीबाग मेखला किस खनिज के प्रमुख उत्पादक है?,अभ्रक,Geography
भारतस्य प्राचीनतमं तैल-उत्पादक-राज्यं कः राज्यः अस्ति ?,असम,Geography
भारतस्य समृद्धतमः खनिजमेखला ......................,प्रायद्वीपीय पठार,Geography
नाडीभ्यः लोडेभ्यः च के धातुः प्राप्यन्ते ?,"टीन, ताम्र, जस्ता, सीसा इत्यादयः प्रमुखाः धातुधातुः नाडीभ्यः, लोडेभ्यः च प्राप्यन्ते ।",Geography
चिपको आन्दोलनस्य उद्देश्यं किम् आसीत् ?,वनसंरक्षणम्,Geography
कस्मिन् वन्यजीवसंरक्षणकानूने प्रथमवारं संरक्षितवनस्पतिजातीनां सूचीः समाविष्टा अस्ति ?,वन्यजीव संरक्षण अधिनियम 1972,Geography
तीव्र लीचिंग् इत्यनेन का मृत्तिका निर्मीयते,लैटराइट् मृत्तिका,Geography
औद्योगिकक्षेत्रस्य वर्गीकरणं केन आधारेण सार्वजनिकनिजीक्षेत्रेषु भवति ?,उद्यमानाम् स्वामित्वम्,Geography
भारतस्य म्यान्चेस्टर इति नाम्ना कः नगरः प्रसिद्धः ?,अहमदाबाद,Geography
भारते प्रतिव्यक्तिः इस्पातस्य उपभोगः अस्ति,"२०२२-२३ वर्षे देशे इस्पातस्य उपभोगः ११९.८९ मेट्रिकटनः, प्रतिव्यक्तिः इस्पातस्य उपभोगः ८६.७ किलोग्रामः च आसीत् ।",Geography
सिन्धुगङ्गा नद्यः कुतः उत्पत्तिः अस्ति ?,"भागीरथी' इति गङ्गायाः मुख्यजलं गङ्गोत्री हिमशैलेन पोष्यते, उत्तराञ्चलस्य देवप्रयागे अलकनन्देन च मिलति । हरिद्वारे गङ्गा पर्वतात् समतलं प्रति निर्गच्छति । सिन्धुः बाल्टिस्टन्-गिल्गिट्-नगरयोः मध्ये प्रवहति, अटोक्-नगरस्य पर्वतात् निर्गच्छति ।",Geography
प्रायद्वीपीयनदीद्वयं गर्तद्वारा प्रवहति ?,"नर्मदा, टपि च द्वौ प्रायद्वीपौ नद्यौ स्तः, ये गर्तद्वारा प्रवहन्ति ।",Geography
अद्यतनस्य के महाद्वीपाः गोण्डवानाभूमिभागाः आसन् ?,"प्राचीनतमः भूखण्डः, (द्वीपसमूहः भागः), गोण्डवानाभूमिस्य भागः आसीत् । गोण्डवानाभूमौ भारतं, आस्ट्रेलिया, दक्षिणाफ्रिका, दक्षिण-अमेरिका च एकैकं भूखण्डरूपेण अन्तर्भवति स्म ।",Geography
अन्तर्राष्ट्रीयसीमा कौ देशौ दीर्घतमा अस्ति ?,कनाडादेशः अमेरिकादेशः च,Geography
विश्वस्य सघनजनसंख्यायुक्तं नगरं किम् ?,"मनिला, फिलिपिन्स",Geography
भारते निम्नलिखितराज्येषु कः राज्यः काफीयाः बृहत्तमः उत्पादकः अस्ति ?,कर्नाटकम्,Geography
सिरोही-बिन्दुः पृथिव्यां कुत्र स्थितः अस्ति ?,अण्टार्टिका,Geography
भारतस्य बृहत्तमा अन्तर्देशीयलवणार्द्रभूमिव्यवस्था कस्मिन् राज्ये स्थिता अस्ति ?,राजस्थान,Geography
भारतस्य कुलक्षेत्रस्य कियत् प्रतिशतं गङ्गानद्याः व्याप्तम् अस्ति ?,26.30%,Geography
अलकनन्दनदी कस्मात् हिमशैलात् उत्पन्ना अस्ति ?,सतोपन्थ हिमशैल,Geography
का नदी वुलर-सरोवरस्य पोषणं करोति ?,झेलुम्,Geography
व्हीलरद्वीपः पूर्वं कस्य द्वीपस्य नाम आसीत् ?,व्हीलरद्वीपः अब्दुलकलामद्वीपस्य पूर्वनाम आसीत् । अयं ओडिशा-नगरस्य तटे स्थितः अस्ति । अस्मिन् द्वीपे रक्षासंशोधनविकाससङ्गठनस्य एकीकृतपरीक्षणपरिधिः (DRDO) अस्ति ।,Geography
कश्मीर हरणः यत्र लभ्यते तत्र एकमात्रं अभयारण्यं कः ?,दचिगाम राष्ट्रियनिकुञ्जं एकमेव अभयारण्यम् अस्ति यत्र कश्मीरस्य हरणः दृश्यते । इदं काश्मीरे स्थितम् अस्ति ।,Geography
भारते कस्मिन् वर्षे जैवमण्डलसंरक्षणकार्यक्रमस्य आरम्भः अभवत् ?,जैवमण्डलसंरक्षणकार्यक्रमस्य आरम्भः भारते १९८६ तमे वर्षे अभवत् ।भारते कुलम् १८ जैवमण्डलसंरक्षणाः सन्ति ।,Geography
जीवाश्मः सामान्यतया कस्मिन् प्रकारे शिलायां दृश्यन्ते ?,"जीवाश्मः सामान्यतया अवसादीशिलासु निर्मीयन्ते । यदा जीवः मृतः भूत्वा अवसादेषु निहितः भवति तदा एते अवसादाः अन्ते जीवाश्मरूपेण संरक्षितेन जीवेन सह अवसादीशिलारूपेण कठोरताम् अवाप्नुवन्ति । एषा प्रक्रिया जीवाश्मीकरणम् इति कथ्यते । आग्नेय-रूपान्तर-शिलाः तापात् वा दबावात् वा निर्मीयन्ते, तेषां जीवाश्म-विनाशस्य सम्भावना वर्तते ।",Geography
“औषधरेखा” अक्षांशवृत्तस्य अन्यत् नाम अस्ति ?,"४९ तमे समानान्तरस्य उपनाम मेडिसिन् लाइन् इति अभवत् यतः १८०० तमे वर्षे अमेरिकीसैनिकानाम् अभियानानां समये तस्य पारगमनं निवारयितुं जादुई इव क्षमता अस्ति ४९तमः समानान्तरः उत्तरः यूरोपं, एशिया, प्रशान्तमहासागरं, उत्तर-अमेरिका, अटलाण्टिकमहासागरं च लङ्घयति ।",Geography
चन्द्रभागा इति अपि प्रसिद्धा चेनाबनदी चन्द्रभागनद्ययोः विलयेन सह कस्य स्थानस्य समीपे भवति ?,"हिमाचलप्रदेशस्य लहौलस्पीतिमण्डले तण्डीनगरे चन्द्रभागनद्याः चन्द्रभागनद्याः विलयेन चन्द्रभागनदी इति चेनाबनदी निर्मिता अस्ति । चन्द्र-भग-नद्यौ ४,८९१ मीटर्-उच्चतायां बारालाचा-दर्रे विपरीतपार्श्वाद् उद्भवति । तण्डी-नगरे २,२८६ मीटर्-उच्चतायां मिलन्ति ।",Geography
"कस्य ग्रहस्य दिवसदीर्घता, अक्षस्य झुकावः च पृथिव्याः समानः प्रायः भवति ।",मंगलः,Geography
विश्वस्य बृहत्तमः द्वीपदेशः कः ?,"इन्डोनेशिया विश्वस्य बृहत्तमः द्वीपदेशः अस्ति यतः अस्य क्षेत्रफलं १,९०४,५६९ वर्गकिलोमीटर् अस्ति तथा च अत्र १८,३०७ द्वीपाः अधिकाः सन्ति । विश्वस्य सर्वाधिकजनसंख्यायुक्तः द्वीपदेशः अपि अस्ति ।",Geography
बृहत्तरनद्याः उपनदीयुक्ताः द्रोणीः के उच्यन्ते ?,पार्श्वद्रोणी इति द्रोणी यस्याः उपनदी बृहत्तरा नदी अस्ति । ते पर्वतसमीपे उच्चतरक्रमस्य द्रोणीः सन्ति ।,Geography
