Question,Answer,Domain
मक्षिकाणां स्वामी इत्यस्मिन् नेत्रस्य प्रतीकत्वस्य विश्लेषणं कुरुत।,"मक्षिकाणां स्वामी इत्यस्य सन्देशः मानवस्वभावे द्विविधतायाः विषये वर्तते यत् जनान् सभ्यतां, संगठितं, शान्तिपूर्णं च भवितुं प्रेरयति, परन्तु अराजकतावादी, हिंसकाः, क्रूराः च भवेयुः। बालकाः सहकारिणः नागरिकाः च इति आरभन्ते, परन्तु ते द्वीपे स्वसमये वितरन्ति, अधिकांशः क्रूरः अराजकतावादी च भवति ।",Literature
लोलितायां अविश्वसनीयकथाकारस्य अवधारणायाः चर्चां कुरुत।,"अविश्वसनीयः कथाकारः इति नाम्ना हम्बर्ट् पाठकं प्रभावितं कर्तुं प्रयत्ने अनेकाः भिन्नाः पद्धतयः प्रयुङ्क्ते । अनेकप्रसङ्गेषु स्वस्य उन्मादस्य अतिक्रीडां कृत्वा सः अन्तर्निहितरूपेण स्वजीवनस्य नियन्त्रणस्य हानिः इति भावः बोधयितुं प्रयतते, तस्मात् उत्तरदायित्वं परिहरति",Literature
टॉमः कर्णयोः पृष्ठतः प्रक्षालितः वा इति परीक्षितुं पोली चाची किं प्रयुङ्क्ते?,पोली चाची आर्द्रतौल्यस्य उपयोगं करोति यत् टॉमः कर्णयोः पृष्ठतः प्रक्षालितवान् वा इति परीक्षते।,Literature
इन्जुन् जो डॉ. रॉबिन्सन् इत्यस्य किं करोति ?,"त्रयाणां पुरुषाणां मध्ये युद्धस्य अनन्तरं, यस्मिन् मफ् पोटरः अचेतनः भवति, इन्जुन् जो मफस्य छूरेण डॉ. रॉबिन्सन् इत्यस्य छूरापातं करोति । हक् टॉमः च पलायन्ते, इन्जुन् जो इत्यस्य मत्तं मफ् इत्यस्य मनसि प्रत्यययितुं न शृण्वन्ति यत् सः एव हत्यारा अस्ति।",Literature
हैम्लेटस्य पिता कथं मृतः ?,"अहं भवतः पितुः आत्मा अस्मि' इति भूतः हैम्लेट् इत्यस्मै वदति। तत्र तस्मै कथ्यते यत् हैम्लेटस्य पिता स्वाभाविकतया न मृतः, अपितु तस्य भ्रात्रा क्लाउडियस् इत्यनेन हतः । यदा राजा सुप्तवान् तदा क्लाउडियसः तस्य कर्णे विषं स्थापयित्वा राज्ञः दुःखदः मृत्युः अभवत् । भूतः हैम्लेट् इत्यस्मै क्लाउडियसस्य प्रतिशोधं कर्तुं वदति यत् सः स्वपितुः हत्यां कृतवान् ।",Literature
मोटिफस्य प्रतीकस्य च कः भेदः ?,सम्पूर्णे कथायां आकृतिः पुनरावृत्तिः भवितुमर्हति; प्रतीकाः एकवारमेव दृश्यन्ते,Literature
"""नाट्यविडम्बना"" इति पदं परिभाषयन्तु ।","नाटकीयविडम्बना विडम्बनारूपं यत् कृतिसंरचनाद्वारा व्यक्तं भवति : कृतिस्य पात्राणि यस्मिन् परिस्थितौ विद्यन्ते तस्य विषये प्रेक्षकाणां जागरूकता पात्राणां विद्यते, अतः पात्राणां वचनं कर्म च भिन्नं गृह्णाति— प्रायः विरोधाभासः—कार्यस्य पात्राणां कृते यत् तेषां कृते यत् अस्ति तस्मात् प्रेक्षकाणां कृते अर्थः।",Literature
बिल्डुंग्स्रोमन-विधायाः किं महत्त्वम् ?,"साहित्यसमालोचने बिल्डुंग्स्रोमनः एकः साहित्यिकविधा अस्ति यः नायकस्य बाल्यकालात् प्रौढतापर्यन्तं (वयसः आगमनं) मनोवैज्ञानिकनैतिकवृद्धौ केन्द्रितः अस्ति,[1] यस्मिन् चरित्रपरिवर्तनं महत्त्वपूर्णम् अस्ति",Literature
साहित्यिकग्रन्थस्य वातावरणे परिवेशः कथं योगदानं ददाति ?,"कथायाः मनोदशां निर्मातुं परिवेशः अपि महतीं भूमिकां कर्तुं शक्नोति । यथा - अन्धकारमयः विषादपूर्णः च परिवेशः अस्वस्थतायाः तनावस्य च भावः उत्पद्यते, सूर्य्यप्रकाशः प्रसन्नः च परिवेशः शान्तिसुखस्य भावः जनयितुं शक्नोति",Literature
"""चेतनाधारा"" आख्यानस्य अवधारणा व्याख्यातव्यम्।",चैतन्यस्य धारा एकः आख्यानशैली अस्ति या पात्रस्य विचारप्रक्रियाम् यथार्थरूपेण गृहीतुं प्रयतते ।,Literature
साहित्ये अविश्वसनीयकथाकारस्य का भूमिका ?,अविश्वसनीयः कथाकारः सः कथाकारः भवति यस्य कथायाः पूर्णतया विश्वासः कर्तुं न शक्यते । कदाचित् अविश्वसनीयः कथाकारः पाठकात् सूचनां सचेतनतया निरोधयति अथवा भ्रान्तिं कर्तुम् इच्छति; अन्यदा कथकस्य अविश्वसनीयता तेषां वशतः परा भवति।,Literature
अन्तरपाठ्यता साहित्यिकं कथं समृद्धयति ?,"लेखकाः समीक्षात्मकं वा अतिरिक्तं वा अर्थं निर्मातुं, बिन्दुं वक्तुं, हास्यं निर्मातुं, मौलिकग्रन्थस्य पुनः व्याख्यां कर्तुं वा अन्तरपाठ्यतायाः उपयोगं कर्तुं शक्नुवन्ति ।",Literature
"""पन्नी चरित्रम्"" इति पदं परिभाषयन्तु ।","पन्नीपात्रं मुख्यपात्रस्य, नायकस्य वा विपरीतरूपेण कार्यं कुर्वन् साहित्यिकतत्त्वम् अस्ति ।",Literature
त्रासदी-हास्ययोः किं भेदः ?,"हास्यकथा सुखान्तयुक्ता हास्यकथा भवति, त्रासदी तु दुःखदसमाप्तियुक्ता गम्भीरकथा भवति।",Literature
"नाटकसाहित्ये ""कैथरिस"" इत्यस्य अवधारणां व्याख्यातव्यम् ।",कलाद्वारा प्रबलानाम् अथवा निहितानाम् भावनानां मुक्तिः प्रक्रिया अस्ति कैथरिसः,Literature
आख्याने पूर्वछायाकरणस्य किं प्रयोजनम् ?,"पूर्वछायाकरणं कथानकतत्त्वं यत् कथायां पश्चात् किमपि आगमिष्यमाणस्य संकेतं ददाति । लेखने पूर्वछायाप्रयोगस्य बहवः कारणानि सन्ति, यथा रोमाञ्चस्य निर्माणं, जिज्ञासां स्फुरणं, तस्य “अहा” क्षणस्य कृते भवतः पाठकस्य सज्जीकरणं च",Literature
काव्ये विशिष्टप्रभावस्य निर्माणार्थं कथं अलङ्कारस्य उपयोगः भवति ?,"अलङ्कारः क्रमेण शब्दानां श्रृङ्खलायाः आरम्भे एकस्यैव ध्वनिस्य पुनरावृत्तिः भवति यस्य उद्देश्यं श्रव्यनाडीं प्रदातुं भवति यत् लेखनस्य एकं खण्डं लुलिङ्गं, गीतात्मकं, भावात्मकं च प्रभावं ददाति",Literature
सॉनेटस्य संरचनां व्याख्यातव्यम्,आङ्ग्लसॉनेट् प्रायः त्रयः चतुष्कैः (४-पङ्क्ति-छन्दाः) तदनन्तरं तुक-युग्मेन निर्मिताः भवन्ति,Literature
"""व्यक्तिकरणम्"" इति पदं परिभाषयन्तु ।","व्यक्तिकरणं “साहित्यात्मकं वा कलात्मकं वा प्रभावं यथा भवति तथा वस्तुषु अमूर्तविचारादिषु मानवलक्षणानाम् आरोपणं”, “व्यक्तिजीवादिरूपेण अमूर्तगुणस्य विचारस्य वा प्रतिनिधित्वं यथा कलासाहित्ययोः” २.",Literature
"""भारतीय आङ्ग्लसाहित्यस्य जनकः"" कः मन्यते ?",मुल्क राज आनंद,Literature
वाल्मीकि लिखित महाकाव्य का नाम बताइए।,रामायणम्,Literature
भारतीयसाहित्ये भक्ति-आन्दोलनस्य किं महत्त्वम् ?,"सर्वेषां विभिन्नानां हिन्दुदेवतानां एकता, ईश्वरस्य समर्पणं, सर्वेषां जनानां समानता, भ्रातृत्वं च, जीवनस्य प्रथमाङ्कस्य प्राथमिकतारूपेण ईश्वरभक्तिः च इति विषये बलं दत्तवान्",Literature
कः भारतीयः लेखकः साहित्यस्य नोबेल् पुरस्कारं प्राप्तवान् ?,रवीन्द्रनाथ टैगोरः भारत-एशिया-देशयोः प्रथमः व्यक्तिः अभवत् यः नोबेल्-पुरस्कारं प्राप्तवान् ।,Literature
"रवीन्द्रनाथ टैगोरस्य ""गीतांजलि"" इत्यस्य केन्द्रविषयः कः ?",रहस्यवादः,Literature
"मराठीसाहित्ये ""बखर"" विधायाः किं महत्त्वम् ?",मराठा शासक चत्रपति शिवाजी महाराज के कर्मों का वृत्तांत।,Literature
देशभक्तिसामाजिकविषयेषु प्रसिद्धस्य मराठीकविस्य प्रसिद्धस्य नाम वदतु।,फकीर चन्द भारती,Literature
ब्रिटिशराजस्य सामाजिकराजनैतिकविषयाणां अन्वेषणं कः मराठी उपन्यासः करोति ?,राम धारी,Literature
"""मणिनि"" मराठी उपन्यासस्य रचयिता कः ?",एन एस फडके,Literature
"रवीन्द्रनाथ टैगोरस्य बङ्गला उपन्यासस्य ""गोरा"" इत्यस्य मुख्यविषयः कः ?","राष्ट्रवादः, अस्मिता, सामाजिकसुधारः च।",Literature
"""सिलप्पाधिकरणम्"" इति तमिल उपन्यासस्य रचयिता कः ?",इलाङ्गो आदिगल,Literature
प्रकृति-आध्यात्म-विषयेषु कृतैः प्रसिद्धस्य मलयालम-कविस्य नाम वदतु।,सुगथाकुमारी,Literature
"हिन्दीसाहित्ये ""प्रेमचन्दयुगस्य"" किं महत्त्वम् ?","प्रेमचन्दस्य कृतीषु दलित, महिला, कृषक इत्यादीनां हाशियाकृतसमूहानां संघर्षाणां, कष्टानां च चित्रणं कृत्वा राष्ट्रियविषयाणां समाधानार्थं सामाजिकसौहार्दस्य आवश्यकतां रेखांकितम् अस्ति",Literature
"""वामसावृक्ष"" कन्नड उपन्यासस्य रचयिता कः ?",एस एल भ्यरप्पा,Literature
भारतीयनवतरङ्ग-आन्दोलनस्य साहित्ये किं महत्त्वम् ?,"नवीनतरङ्गात् पूर्वं लोकप्रियः हिन्दी-चलच्चित्रः अधिकतया हिन्दी-साहित्यस्य सर्वथा अवहेलनां कृतवान् आसीत्, तस्य स्थाने उर्दू-भाषायाः कृते संकर-काव्य-भाषायाः कृते गतवान् यस्मिन् सः प्रेम-विश्वास-न्यायस्य विषये वदति स्म भारतीयनवतरङ्गेन साहित्यिकहिन्दीभाषायाः संस्कृतनवपदानि प्रथमवारं सिनेमारङ्गमण्डपेषु आनयत् ।",Literature
"अरुन्धतिरायस्य ""लघुवस्तूनाम् देवः"" इति उपन्यासस्य विषयः कः ?","अरुन्धतिरायस्य द गॉड आफ् स्मॉल थिङ्ग्स् इति ग्रन्थः भारते द्वयोः भ्रातृमिथुनयोः विषये अस्ति येषां जीवनं तेषां अतीतानां त्रासदीभिः निर्धारितं भवति । महत्त्वपूर्णविषयेषु परिवारः, निष्ठा, निषिद्धः प्रेम, उपनिवेशवादः/उत्तर-उपनिवेशवादः, शिक्षाभेदः, सामाजिकवर्गविषमता च सन्ति ।",Literature
भारते दलितसाहित्य-आन्दोलनस्य किं महत्त्वम् ?,"भारतीयसमाजस्य जाति-आधारित-रूपरेखायाः अन्तः दलित-समुदायस्य मार्मिक-सामाजिक-राजनैतिक-अनुभवानाम् संप्रेषणाय दलित-साहित्यस्य सशक्त-माध्यमस्य कार्यं करोति । दलितानां जीवनं स्वरूपयन्तः असंख्यसामाजिककारकाणां, दलित-अदलित-समुदाययोः सह तेषां अन्तरक्रियाणां च विषये प्रकाशं प्रसारयति ।",Literature
सकलराष्ट्रीयउत्पाद परिभाषयतु। कल्याणपरिमाणरूपेण तस्य घटकान् सीमां च व्याख्यातव्यम्।,"सकलघरेलूउत्पादस्य अर्थः सकलघरेलूउत्पादः । इदं कस्यचित् देशस्य सीमान्तर्गतं विशिष्टकालस्य अन्तः उत्पादितानां सर्वेषां वस्तूनाम् सेवानां च कुलमूल्यं भवति, सामान्यतया वार्षिकरूपेण वा त्रैमासिकरूपेण वा कल्याणं समाजस्य अन्तः व्यक्तिनां समग्रं कल्याणं जीवनस्य गुणवत्ता च निर्दिश्यते ।",Economics
महङ्गानि किं कारणं भवति ? तस्य प्रभावानां नीतिप्रतिक्रियाणां च चर्चां कुर्वन्तु।,"अधिकानि कार्याणि, अधिकं वेतनं च गृहेषु आयं वर्धयति तथा च उपभोक्तृव्ययस्य वृद्धिं करोति, समुच्चयमागधा अधिकं वर्धयति, फर्माणां कृते स्ववस्तूनाम् सेवानां च मूल्यवर्धनस्य व्याप्तिः च भवति यदा बहूनां व्यापारेषु क्षेत्रेषु च एतत् भवति तदा एतेन महङ्गानि वर्धन्ते ।",Economics
"बेरोजगारी परिभाषयतु। तस्य प्रकाराः, कारणानि, नीतिसमाधानं च विश्लेषयन्तु ।","यदा कार्यं कर्तुम् इच्छन्तः श्रमिकाः कार्यं प्राप्तुं असमर्थाः भवन्ति तदा बेरोजगारी भवति । बेरोजगारी-दरस्य उच्च-दराः आर्थिक-दुःखस्य संकेतं ददति, यदा तु बेरोजगारी-दरस्य अत्यन्तं न्यून-दराः अति-तापित-अर्थव्यवस्थायाः संकेतं दातुं शक्नुवन्ति । बेरोजगारी घर्षणात्मकं, चक्रीयं, संरचनात्मकं, संस्थागतं वा इति वर्गीकरणं कर्तुं शक्यते ।",Economics
"भुक्तिशेषं व्याख्यातव्यम्। तस्य घटकानां, तस्य प्रभावं जनयन्तः कारकाः च चर्चां कुर्वन्तु।","भुक्तितुल्यता (BOP) इति पद्धतिः यया देशाः एकस्य निश्चितकालस्य अन्तः अन्तर्राष्ट्रीयमौद्रिकव्यवहारस्य सर्वेषां मापनं कुर्वन्ति । बीओपी-मध्ये मुख्यतया त्रयः खाताः सन्ति : चालूलेखः, पूंजीलेखः, वित्तीयलेखः च ।",Economics
वित्तनीतिः किम् ? तस्य साधनानि स्थिरीकरणे प्रभावशीलता च व्याख्यातव्याः,"राजकोषनीतिः सार्वजनिकव्ययस्य, करस्य, सार्वजनिकऋणस्य च विषये सर्वकारीयनीतिं निर्दिशति । राष्ट्रस्य अर्थव्यवस्थायाः निरीक्षणं प्रभावं च कर्तुं सर्वकारः स्वव्ययस्तरं करदराणि च समायोजयति इति साधनम् ।",Economics
लोचं परिभाषयतु। आर्थिकनिर्णयेषु तस्य प्रकाराः महत्त्वं च व्याख्यातव्यम्।,लोचः एकः आर्थिकः अवधारणा अस्ति यस्य उपयोगः तस्य मालस्य वा सेवायाः वा मूल्यगतिसम्बद्धे वस्तुनः सेवायाः वा आग्रहितस्य समुच्चयमात्रायाः परिवर्तनस्य मापनार्थं भवति यदि उत्पादस्य मूल्यं वर्धते न्यूनता वा भवति तदा उत्पादस्य परिमाणमागधा आनुपातिकतया अधिकं परिवर्तते तर्हि उत्पादः लोचना इति मन्यते ।,Economics
सम्यक् स्पर्धां व्याख्यातव्यम्। अल्पकालिकस्य दीर्घकालीनस्य च संतुलनस्य विश्लेषणं कुर्वन्तु।,"अल्पकालं यावत् समता माङ्गल्याः प्रभावः भविष्यति। दीर्घकालं यावत् उत्पादस्य मागः, आपूर्तिः च सम्यक् स्पर्धायां समतां प्रभावितं करिष्यन्ति । एकः फर्मः समताबिन्दौ दीर्घकालं यावत् केवलं सामान्यलाभं प्राप्स्यति।",Economics
